ID_SPPG,Status_Pengajuan,Status_Operasional,Kota_Kabupaten,Provinsi,Alamat
IPOCOB2V,Penentuan KA SPPG,Belum Beroperasi,KOTA BANDUNG,JAWA BARAT,"Jl Jendral Sudirman no 624, DUNGUS CARIANG, ANDIR, KOTA BANDUNG, JAWA BARAT"
XOQ7N3UQ,Penentuan KA SPPG,Belum Beroperasi,KAB. SUKOHARJO,JAWA TENGAH,"Pijilan RT 04 RW 13 Makamhaji Kartasura Sukoharjo, MAKAMHAJI, KARTASURA, KAB. SUKOHARJO, JAWA TENGAH"
BJLZRAWN,Penentuan KA SPPG,Belum Beroperasi,KAB. BANTUL,DAERAH ISTIMEWA YOGYAKARTA,"Komplek Gumuk Indah Kidul, Jl. Kresno No.8, Jomegatan, Tirtonirmolo, Kec. Kasihan, Kota Yogyakarta, Daerah Istimewa Yogyakarta 55251, TIRTONIRMOLO, KASIHAN, KAB. BANTUL, DAERAH ISTIMEWA YOGYAKARTA"
GDEDQP4M,Penentuan KA SPPG,Belum Beroperasi,KAB. BOGOR,JAWA BARAT,"Cipayung Datar, Megamendung, Bogor Regency, West Java 16770, PASIR ANGIN, MEGAMENDUNG, KAB. BOGOR, JAWA BARAT"
XQZCDXHX,Penentuan KA SPPG,Belum Beroperasi,KAB. MAROS,SULAWESI SELATAN,"Jalan Darul Istiqomah, Bontoa, Turikale, , TAROADA, TURIKALE, KAB. MAROS, SULAWESI SELATAN"
EY9TI1BT,Penentuan KA SPPG,Belum Beroperasi,KAB. PAMEKASAN,JAWA TIMUR,"Dusun Gunung Tangis, REK KERREK, PALENGGAAN, KAB. PAMEKASAN, JAWA TIMUR"
QNOMOEVV,Penentuan KA SPPG,Belum Beroperasi,KOTA PALANGKARAYA,KALIMANTAN TENGAH,"JL. GARUDA 5 Gg 4 No. 1, PALANGKA, JEKAN RAYA, KOTA PALANGKARAYA, KALIMANTAN TENGAH"
JOXNNMSN,Penentuan KA SPPG,Belum Beroperasi,KAB. PRINGSEWU,LAMPUNG,"JALAN RAYA SUKOHARJO, SUKOHARJO III, SUKOHARJO, KAB. PRINGSEWU, LAMPUNG"
AH0LWVKB,Penentuan KA SPPG,Belum Beroperasi,KAB. SUKABUMI,JAWA BARAT,"Kp. Pamoyanan RT.001 RW.002, WALURAN, WALURAN, KAB. SUKABUMI, JAWA BARAT"
PWA2ECX3,Penentuan KA SPPG,Beroperasi,KOTA TANGERANG SELATAN,BANTEN,"Jl. Tiga Berlian No.88, Ciater, Kec. Serpong, Kota Tangerang Selatan, Banten 15310, CIATER, SERPONG, KOTA TANGERANG SELATAN, BANTEN"
NWDLR391,Penentuan KA SPPG,Belum Beroperasi,KAB. LAMPUNG SELATAN,LAMPUNG,"Purwodadi Simpang RT/RW 004/003 Kec. Tanjung Bintang Kab. Lampung Selatan, PURWODADI SIMPANG, TANJUNG BINTANG, KAB. LAMPUNG SELATAN, LAMPUNG"
TJMZRRFM,Penentuan KA SPPG,Belum Beroperasi,KAB. MAROS,SULAWESI SELATAN,"Jln. Poros Makassar Maros, KM 25, BONTOA, MANDAI, KAB. MAROS, SULAWESI SELATAN"
VRWN87XE,Penentuan KA SPPG,Belum Beroperasi,KAB. SUMBAWA,NUSA TENGGARA BARAT,"Dusun Talemo, Desa Bunga Eja, Kec. Empang, Kab. Sumbawa, Prov. Nusa Tenggara Bar, BUNGA EJA, EMPANG, KAB. SUMBAWA, NUSA TENGGARA BARAT"
MV3THBFC,Penentuan KA SPPG,Belum Beroperasi,KAB. SERANG,BANTEN,"kp. Kubang putih Ds. sukabares, SUKABARES, WARINGINKURUNG, KAB. SERANG, BANTEN"
WMQ1CVMU,Penentuan KA SPPG,Belum Beroperasi,KOTA MAKASSAR,SULAWESI SELATAN,"LR  REWATA II RT003/RW 003, SUDIANG, BIRINGKANAYA, KOTA MAKASSAR, SULAWESI SELATAN"
L6LBEJJC,Penentuan KA SPPG,Belum Beroperasi,KAB. SAMPANG,JAWA TIMUR,"Jl. Raya Batioh Masaran Sampang, MASARAN, BANYUATES, KAB. SAMPANG, JAWA TIMUR"
ZBTPPTP9,Penentuan KA SPPG,Belum Beroperasi,KOTA BATAM,KEPULAUAN RIAU,"Anggrek Mas 1 Blok I No 27, TAMAN BALOI, BATAM KOTA, KOTA BATAM, KEPULAUAN RIAU"
SNLQMYDL,Penentuan KA SPPG,Belum Beroperasi,KOTA BATAM,KEPULAUAN RIAU,"Pantai Mak Dare Kampung Melayu.
RT.01/RW.08. Kelurahan Batu Besar Kecamatan Nongsa Batam, BATU BESAR, NONGSA, KOTA BATAM, KEPULAUAN RIAU"
3ZKVWYWP,Penentuan KA SPPG,Belum Beroperasi,KAB. MAJALENGKA,JAWA BARAT,"Jl. K.H. Abdul Halim No.131, MAJALENGKA KULON, MAJALENGKA, KAB. MAJALENGKA, JAWA BARAT"
EQ8KSWOO,Penentuan KA SPPG,Belum Beroperasi,KOTA BATAM,KEPULAUAN RIAU,"kompleks ruko greenland blok V no.03. batam centre, TELUK TERING, BATAM KOTA, KOTA BATAM, KEPULAUAN RIAU"
FTN2GQPA,Penentuan KA SPPG,Belum Beroperasi,KAB. BANDUNG,JAWA BARAT,"Perumahan Villa Ciwidey Asri
Blok I No.14 Jl.Sukajadi No. 3 (Pasir Pogor) Desa Panyocokan Kec. Ciwidey , PANYOCOKAN, CIWIDEY, KAB. BANDUNG, JAWA BARAT"
IDY3KLOF,Penentuan KA SPPG,Beroperasi,KAB. BELITUNG TIMUR,KEPULAUAN BANGKA BELITUNG,"jalan burong mandi dusun kebun sayor rt/rw 008/004, MENGKUBANG, DAMAR, KAB. BELITUNG TIMUR, KEPULAUAN BANGKA BELITUNG"
BGPWPI8Z,Penentuan KA SPPG,Belum Beroperasi,KAB. SUMBAWA,NUSA TENGGARA BARAT,"JALAN BUNG KARNO, Desa/Kelurahan Uma Beringin, Kec. Unter Iwes, Kab. Sumbawa, Provinsi Nusa Tenggara Barat, UMA BERINGIN, UNTER IWES, KAB. SUMBAWA, NUSA TENGGARA BARAT"
7YOKQQ8W,Penentuan KA SPPG,Belum Beroperasi,KAB. BLORA,JAWA TENGAH,"Ds. Ngumbul ,Kec.Todanan , Kab.Pati, NGUMBUL, TODANAN, KAB. BLORA, JAWA TENGAH"
RFUG2HGJ,Penentuan KA SPPG,Belum Beroperasi,KAB. GROBOGAN,JAWA TENGAH,"Ds.Ngabenrejo, Kec.Grobogan , Kab.Grobogan, NGABENREJO, GROBOGAN, KAB. GROBOGAN, JAWA TENGAH"
DQIIJM0Q,Penentuan KA SPPG,Belum Beroperasi,KAB. SERANG,BANTEN,"Kp. Sidilem RT RW 02 01 , TALAGA LUHUR, WARINGINKURUNG, KAB. SERANG, BANTEN"
JKOBG8KY,Penentuan KA SPPG,Beroperasi,KAB. SIDENRENG RAPPANG,SULAWESI SELATAN,"Jln. Poros pare-pare rappang , bangkai , uluale kec. Watang Pulu Kab. Sidenreng Rappang, BANGKAI, WATANG PULU, KAB. SIDENRENG RAPPANG, SULAWESI SELATAN"
0TR18JCY,Penentuan KA SPPG,Belum Beroperasi,KOTA DEPOK,JAWA BARAT,"Jl. Mawar, Blok F III, No. 60A, RT 002/ RW 015, Cinere, CINERE, CINERE, KOTA DEPOK, JAWA BARAT"
WL8UQHBF,Penentuan KA SPPG,Belum Beroperasi,KAB. MAJALENGKA,JAWA BARAT,"Jl pemuda Rt.003 Rw.010 Kelurahan Majalengka Kulon Kecamatan Majalengka Kabupaten Majalengka, MAJALENGKA KULON, MAJALENGKA, KAB. MAJALENGKA, JAWA BARAT"
SKF6SHOA,Penentuan KA SPPG,Belum Beroperasi,KAB. SUMEDANG,JAWA BARAT,"SINDANGGALIH, KEC.CIMANGGUNG KABUPATEN SUMEDANG JAWA BARAT 45364, SINDANGGALIH, CIMANGGUNG, KAB. SUMEDANG, JAWA BARAT"
VDLE1WQF,Penentuan KA SPPG,Belum Beroperasi,KAB. MALANG,JAWA TIMUR,"Jl. P Diponegoro RT.007 RW. 002 Desa Gading Kecamatan Bululawang Kabupaten Malang, GADING, BULULAWANG, KAB. MALANG, JAWA TIMUR"
YKYHK2PF,Penentuan KA SPPG,Belum Beroperasi,KAB. BOGOR,JAWA BARAT,"Jl. Cendana No 18 RT.02 RW.05 Pondokmiri Rawakalong Gunung Sindur Bogor , RAWAKALONG, GUNUNG SINDUR, KAB. BOGOR, JAWA BARAT"
6BD4IGAM,Penentuan KA SPPG,Belum Beroperasi,KAB. JEPARA,JAWA TENGAH,"Jl. Raya desa Daren , DAREN, NALUMSARI, KAB. JEPARA, JAWA TENGAH"
TEAICGXL,Penentuan KA SPPG,Belum Beroperasi,KAB. KARAWANG,JAWA BARAT,"Dusun sukajaya 01/01 Desa Kemiri Kecmatan Jayakerta Kabupaten Karawang Provinsi Jawa Barat, KEMIRI, JAYAKERTA, KAB. KARAWANG, JAWA BARAT"
IVQH4L4W,Penentuan KA SPPG,Belum Beroperasi,KAB. BANGKALAN,JAWA TIMUR,"DUSUN SENDIH DESA CANGKARMAN KECAMATAN KONANG KABUPATEN BANGKALAN, CANGKAREMAN, KONANG, KAB. BANGKALAN, JAWA TIMUR"
Z8FP8IQ0,Penentuan KA SPPG,Belum Beroperasi,KAB. BEKASI,JAWA BARAT,"Jl. Raya Lemah Abang no 196 Kp. Cibeber Desa Simpangan Kec. Cikarang Utara Kabupaten Bekasi, SIMPANGAN, CIKARANG UTARA, KAB. BEKASI, JAWA BARAT"
CDLU2ARE,Penentuan KA SPPG,Belum Beroperasi,KAB. PATI,JAWA TENGAH,"Ds.Kayen,Kec Kayen,, KabPati, SLUNGKEP, KAYEN, KAB. PATI, JAWA TENGAH"
MFDP5QLD,Penentuan KA SPPG,Belum Beroperasi,KOTA PADANG,SUMATERA BARAT,"Komplek Perumahan Hippocrates Houses, Blok A No.4, Kelurahan Ikur Koto, Koto Tangah, Kota Padang, KOTO PANJANG IKUA KOTO, KOTO TANGAH, KOTA PADANG, SUMATERA BARAT"
B4JK7I4T,Penentuan KA SPPG,Belum Beroperasi,KAB. BLORA,JAWA TENGAH,"SUKOLILO RT 001/RW 007 KELURAHAN NGAWEN KECAMATAN NGAWEN KABUPATEN BLORA , NGAWEN, NGAWEN, KAB. BLORA, JAWA TENGAH"
YQ6NMQZZ,Penentuan KA SPPG,Belum Beroperasi,KAB. PATI,JAWA TENGAH,"Tambakromo,Kec Tambakromo, TAMBAKROMO, TAMBAKROMO, KAB. PATI, JAWA TENGAH"
DIQBYFPU,Penentuan KA SPPG,Belum Beroperasi,KAB. KARANGANYAR,JAWA TENGAH,"Dk. Grenjeng No. 26 RT 03 RW 02 , DAYU, GONDANGREJO, KAB. KARANGANYAR, JAWA TENGAH"
SKBOPTFC,Penentuan KA SPPG,Belum Beroperasi,KAB. WAY KANAN,LAMPUNG,"Jln. Utma PonPes No. 01 Tanjung Serupa Sp 6 B, Kec. Pakuan Ratu Kab. Way Kanan Lampung, TANJUNG SERUPA, PAKUAN RATU, KAB. WAY KANAN, LAMPUNG"
NIGGNEUY,Penentuan KA SPPG,Belum Beroperasi,KAB. PURWOREJO,JAWA TENGAH,"Jalan Magelang KM 11, RT 003/004, Kaliboto, Kecamatan Bener, Kabupaten Purworejo, Jawa Tengah,
Indonesia, Titik Koordinat -7.639427926232401, 110.0511674345254, KALIBOTO, BENER, KAB. PURWOREJO, JAWA TENGAH"
SRD4GEJM,Penentuan KA SPPG,Belum Beroperasi,KAB. GARUT,JAWA BARAT,"Jl blok makam desa Cangkuang  kecamatan Leles kabupaten Garut, CANGKUANG, LELES, KAB. GARUT, JAWA BARAT"
RNZOBTSU,Penentuan KA SPPG,Belum Beroperasi,KAB. WAY KANAN,LAMPUNG,"Rt.02 Rw.01 kampung negara harja kec.pakuan ratu kab.way kanan, NEGARA HARJA, PAKUAN RATU, KAB. WAY KANAN, LAMPUNG"
WKZFPITZ,Penentuan KA SPPG,Belum Beroperasi,KAB. MUSI BANYUASIN,SUMATERA SELATAN,"Dusun 5 Sidorahayu rt/rw. 000/005
Kec. Plakat tinggi
Kab. Musi banyuasin, SIDO RAHAYU, PLAKAT TINGGI, KAB. MUSI BANYUASIN, SUMATERA SELATAN"
RLNRHSRV,Penentuan KA SPPG,Belum Beroperasi,KAB. MUSI BANYUASIN,SUMATERA SELATAN,"Desa Penggage RT. 001, Kec Sanga Desa. Kab. Musi Banyuasin, Sumatera Selatan, PENGGAGE, SANGA DESA, KAB. MUSI BANYUASIN, SUMATERA SELATAN"
HCSMKFOJ,Penentuan KA SPPG,Belum Beroperasi,KAB. SUKABUMI,JAWA BARAT,"Jl. Parungseah No.43 KM.4 Desa Cipetir Kec. Kadudampit Kab. Sukabumi Provinsi Jawa Barat, CIPETIR, KADUDAMPIT, KAB. SUKABUMI, JAWA BARAT"
XCJNBUBW,Penentuan KA SPPG,Belum Beroperasi,KAB. PURWOREJO,JAWA TENGAH,"Desa Depokrejo RT01 / RW01, Kecamatan Ngombol ( 54172 ), Kabupaten Purworejo, Jawa Tengah, DEPOKREJO, NGOMBOL, KAB. PURWOREJO, JAWA TENGAH"
JJRLYC4Z,Penentuan KA SPPG,Belum Beroperasi,KAB. KARANGANYAR,JAWA TENGAH,"Harjanto Catering - Jl. Panda 2, Karangrejo RT.02, RW.06, Kel. Karanganyar, Kec. Karanganyar, Kab Karanganyar Jawa Tengah 57711, KARANGANYAR, KARANGANYAR, KAB. KARANGANYAR, JAWA TENGAH"
VMPYNSWX,Penentuan KA SPPG,Belum Beroperasi,KAB. KARANGANYAR,JAWA TENGAH,"Josca Catering - Jl. Srikaton, Tawangmangu RT.05, RW.01, Kel. Tawangmangu, Kec. Tawangmangu, kab. Karanganyar - Jawa Tengah 57792, TAWANGMANGU, TAWANGMANGU, KAB. KARANGANYAR, JAWA TENGAH"
WTOWKGLO,Penentuan KA SPPG,Belum Beroperasi,KAB. SLEMAN,DAERAH ISTIMEWA YOGYAKARTA,"KEPUHSARI-KRODAN 007/005, MAGUWOHARJO, DEPOK, SEMAN, MAGUWOHARJO, DEPOK, KAB. SLEMAN, DAERAH ISTIMEWA YOGYAKARTA"
KB26EWWR,Penentuan KA SPPG,Belum Beroperasi,KAB. BANYUASIN,SUMATERA SELATAN,"Jalan Thalib Wali No.3-4 Rt.10 Rw.04 Kelurahan Pangkalan Balai Kecamatan Banyuasin III Kabupaten Banyuasin Propinsi Sumatera Selatan, PANGKALAN BALAI, BANYUASIN III, KAB. BANYUASIN, SUMATERA SELATAN"
AHHENWN4,Penentuan KA SPPG,Belum Beroperasi,KOTA SEMARANG,JAWA TENGAH,"JL BANGUNHARJO BARAT NO. 1, BANYUMANIK
KOTA SEMARANG 50261 - JAWA TENGAH, BANYUMANIK, BANYUMANIK, KOTA SEMARANG, JAWA TENGAH"
TVQX7CPE,Penentuan KA SPPG,Belum Beroperasi,KAB. PURWOREJO,JAWA TENGAH,"Desa Harjobinangun, Kecamatan Grabag ( 54265 ), Kabupaten Purworejo, Jawa Tengah, HARJOBINANGUN, GRABAG, KAB. PURWOREJO, JAWA TENGAH"
LG1ZTWA3,Penentuan KA SPPG,Belum Beroperasi,KAB. SIDENRENG RAPPANG,SULAWESI SELATAN,"Jalan Sultan Hasanuddin, WALA, MARITENGNGAE, KAB. SIDENRENG RAPPANG, SULAWESI SELATAN"
OT06IYBC,Penentuan KA SPPG,Belum Beroperasi,KAB. CIREBON,JAWA BARAT,"Jalan Wijaya Kusuma No. 59, Desa Babakan, Kecamatan Ciwaringin, Kabupaten Cirebon, Jawa Barat, BABAKAN, BABAKAN, KAB. CIREBON, JAWA BARAT"
BEYRXWIF,Penentuan KA SPPG,Belum Beroperasi,KAB. CIAMIS,JAWA BARAT,"Jl. Ahmad Yani No. 221 Kelurahan Kertasari Kecamatan Ciamis Kabupaten Ciamis Jawa Barat, KERTASARI, CIAMIS, KAB. CIAMIS, JAWA BARAT"
E6R1WMEV,Penentuan KA SPPG,Belum Beroperasi,KAB. LOMBOK TIMUR,NUSA TENGGARA BARAT,"Jalan pendidikan, Desa Aikdewa, Kecamatan Pringgasela, Kabupaten Lombok Timur, NTB., AIK DEWA, PRINGGASELA, KAB. LOMBOK TIMUR, NUSA TENGGARA BARAT"
TZKE5NWA,Penentuan KA SPPG,Belum Beroperasi,KAB. BANJAR,KALIMANTAN SELATAN,"Rumah Makan & Catering Ibu Arlin, jalan Rahayu No 38A Sungai Paring, Martapura, Kabupaten Banjar - Kalimantan Selatan, SUNGAI PARING, MARTAPURA, KAB. BANJAR, KALIMANTAN SELATAN"
XDJLSZSO,Penentuan KA SPPG,Belum Beroperasi,KAB. BREBES,JAWA TENGAH,"Ketanggungan RT.05 RW.04 Kec. Ketanggungan, KETANGGUNGAN, KETANGGUNGAN, KAB. BREBES, JAWA TENGAH"
KRSGDA6P,Penentuan KA SPPG,Belum Beroperasi,KOTA SUKABUMI,JAWA BARAT,"JLN. SEJAHTERA SUKAKARYA RT 003/RW 011.KEL.SUKAKARYA . KOTA SUKABUMI, SUKAKARYA, WARUDOYONG, KOTA SUKABUMI, JAWA BARAT"
NEHAFUNH,Penentuan KA SPPG,Belum Beroperasi,KAB. SUMEDANG,JAWA BARAT,"Jl. Pangeran Sugih No.8 Kelurahan Regol Wetan Kecamatan Sumedang Selatan Kabupaten Sumedang Jawa Barat , REGOL WETAN , SUMEDANG SELATAN, KAB. SUMEDANG, JAWA BARAT"
PUPAWIH7,Penentuan KA SPPG,Belum Beroperasi,KAB. SUMEDANG,JAWA BARAT,"Jl. Prabu Gajah Agung No.120 Kelurahan Situ Kecamatan Sumedang Utara Kabupaten Sumedang Jawa Barat, SITU, SUMEDANG UTARA, KAB. SUMEDANG, JAWA BARAT"
AGNSDJXP,Penentuan KA SPPG,Belum Beroperasi,KAB. BANDUNG,JAWA BARAT,"Solokanjeruk RT.002 RW.003. Desa SOLOKANJERUK Kec Solokanjeruk, Kabupaten Bandung Provinsi Jawa Barat
Titik Kordinat: -7.010604,107.748030, SOLOKANJERUK, SOLOKANJERUK, KAB. BANDUNG, JAWA BARAT"
B75MN2SU,Penentuan KA SPPG,Belum Beroperasi,KAB. MAJALENGKA,JAWA BARAT,"Lingk.Margaraharja RT.001 RW.001 Kel.Cicurug Kec.Majalengka , CICURUG, MAJALENGKA, KAB. MAJALENGKA, JAWA BARAT"
MZT2JOAB,Penentuan KA SPPG,Belum Beroperasi,KAB. JEMBER,JAWA TIMUR,"JALAN BRANJANGAN NO.1 PATRANG JEMBER, BINTORO, PATRANG, KAB. JEMBER, JAWA TIMUR"
RPLAJVAP,Penentuan KA SPPG,Belum Beroperasi,KAB. BANGKALAN,JAWA TIMUR,"DSN KWANYAR RT 002 / RW 003 BUMI ANYAR TANJUNGBUMI BANGKALAN, BUMI ANYAR, TANJUNG BUMI, KAB. BANGKALAN, JAWA TIMUR"
LUD0ZWLE,Penentuan KA SPPG,Belum Beroperasi,KAB. KETAPANG,KALIMANTAN BARAT,"Jl Rahadi Usman Dusun Sei Sirih Desa Sei Besar, SUNGAI BESAR, MATAN HILIR SELATAN, KAB. KETAPANG, KALIMANTAN BARAT"
EQEX4UFS,Penentuan KA SPPG,Belum Beroperasi,KAB. PANDEGLANG,BANTEN,"Belakang Terminal Bus Labuan, Kp. Kaduparasi 015/005 Ds Margasana Kec. Pagelaran Kab. Pandeglang Banten, MARGASANA, PAGELARAN, KAB. PANDEGLANG, BANTEN"
7KBUERHB,Penentuan KA SPPG,Belum Beroperasi,KAB. ACEH TIMUR,ACEH,"JL. Lintas Banda Aceh-Medan No 1,2 Alue Nibong, Kecamatan Peureulak, Kabupaten Aceh Timur, Aceh 24453, ALUE NIBONG, PEUREULAK, KAB. ACEH TIMUR, ACEH"
9GQQ0TQZ,Penentuan KA SPPG,Belum Beroperasi,KOTA SUBULUSSALAM,ACEH,"Jl. Syeh Hamzah Fansuri KM2 Desa Lae Pemualan Kec. Rundeng Kota Subulussalam Prov. Aceh, LAE PEMULAAN, RUNDENG, KOTA SUBULUSSALAM, ACEH"
QUHIQ09J,Penentuan KA SPPG,Belum Beroperasi,KAB. ACEH SELATAN,ACEH,"Jl. TR. Angkasah Lhok Bengkuang, Tapak Tuan, Aceh Selatan, LHOK BENGKUANG, TAPAKTUAN, KAB. ACEH SELATAN, ACEH"
QGVNZHRZ,Penentuan KA SPPG,Belum Beroperasi,KAB. SUMEDANG,JAWA BARAT,"Jl. Panyindangan No 16 , KOTA KULON , SUMEDANG SELATAN, KAB. SUMEDANG, JAWA BARAT"
IE2RVZ72,Penentuan KA SPPG,Belum Beroperasi,KAB. TEGAL,JAWA TENGAH,"Jalan Raya Tegal-Pemalang Kelurahan Kedungkelor, Kecamatan Warureja, Kabupaten Tegal (Kode Pos: 52183), KEDUNGKELOR, WARUREJA, KAB. TEGAL, JAWA TENGAH"
R3VTKKWA,Penentuan KA SPPG,Belum Beroperasi,KAB. SAMPANG,JAWA TIMUR,"Jl. Raya Krampon Dusun Krampon Tengah Desa Krampon, Kecamatan Torjun, Kabupaten Sampang Provinsi Jawa Timur , KRAMPON, TORJUN, KAB. SAMPANG, JAWA TIMUR"
LGDVULFR,Penentuan KA SPPG,Beroperasi,KAB. JENEPONTO,SULAWESI SELATAN,"jl. poros jeneponto bantaeng, TOGO TOGO, BATANG, KAB. JENEPONTO, SULAWESI SELATAN"
YGTDOECU,Penentuan KA SPPG,Belum Beroperasi,KAB. MAGELANG,JAWA TENGAH,"Mangli, Girirejo, Ngablak, Magelang Regency, Central Java 56194, GIRIREJO, NGABLAK, KAB. MAGELANG, JAWA TENGAH"
KDPJLNYE,Penentuan KA SPPG,Belum Beroperasi,KAB. CILACAP,JAWA TENGAH,"DUSUN TEGALSARI RT 04 RW 05 DESA KAWUNGANTERN LOR KEC. KAWUNGANTEN KAB. CILACAP, KAWUNGANTEN LOR, KAWUNGANTEN, KAB. CILACAP, JAWA TENGAH"
BBRVPHKO,Penentuan KA SPPG,Belum Beroperasi,KAB. CILACAP,JAWA TENGAH,"Jalan raya Pahonjean Cibeunying Kec Majenang Cilacap, CIBEUNYING, MAJENANG, KAB. CILACAP, JAWA TENGAH"
KYTTB6H8,Penentuan KA SPPG,Belum Beroperasi,KAB. CILACAP,JAWA TENGAH,"Jl Matahari no. 14 Tanjungsari Sindangsari kec Majenang, SINDANGSARI, MAJENANG, KAB. CILACAP, JAWA TENGAH"
PGMG2UUW,Penentuan KA SPPG,Belum Beroperasi,KOTA SEMARANG,JAWA TENGAH,"Jangli, Kec. Tembalang, Kota Semarang, Jawa Tengah, JANGLI, TEMBALANG, KOTA SEMARANG, JAWA TENGAH"
JTVHXDCC,Penentuan KA SPPG,Belum Beroperasi,KAB. JEMBRANA,BALI,"JL. NGURAH RAI NO. 111, DAUHWARU, JEMBRANA, KAB. JEMBRANA, BALI"
AZVLGGWD,Penentuan KA SPPG,Belum Beroperasi,KAB. PIDIE JAYA,ACEH,"Jl Lingkar Desa Meunasah Dayah Kecamatan Bandar Baru Kabupaten Pidie Jaya Provinsi Aceh, KEUDE LUENG PUTU, BANDAR BARU, KAB. PIDIE JAYA, ACEH"
Y6ZY3VLF,Penentuan KA SPPG,Belum Beroperasi,KOTA BEKASI,JAWA BARAT,"Jalan M Hasibuan no 2, MARGAHAYU, BEKASI TIMUR, KOTA BEKASI, JAWA BARAT"
SXVL8WAX,Penentuan KA SPPG,Belum Beroperasi,KAB. SUKABUMI,JAWA BARAT,"Jl. Taman jaya Kp. Cigaok Desa Taman Jaya Kec. Ciemas, TAMANJAYA, CIEMAS, KAB. SUKABUMI, JAWA BARAT"
GCHY08LL,Penentuan KA SPPG,Belum Beroperasi,KOTA YOGYAKARTA,DAERAH ISTIMEWA YOGYAKARTA,"Jl. Nitikan Baru no 36 sorosutan, umbulharjo, yogyakarta, SOROSUTAN, UMBULHARJO, KOTA YOGYAKARTA, DAERAH ISTIMEWA YOGYAKARTA"
W3OY1TSK,Penentuan KA SPPG,Belum Beroperasi,KOTA LHOKSEUMAWE,ACEH,"Jln. Listrik Sp. Besi Tua No. 5-6
, HAGU TEUNGOH, BANDA SAKTI, KOTA LHOKSEUMAWE, ACEH"
MF95HDNP,Penentuan KA SPPG,Belum Beroperasi,KAB. BANGKALAN,JAWA TIMUR,"Jl. Halim Perdana Kusuma, MLAJAH, BANGKALAN, KAB. BANGKALAN, JAWA TIMUR"
WBN1S8XZ,Penentuan KA SPPG,Belum Beroperasi,KAB. ACEH BARAT DAYA,ACEH,"Jl. Tgk. Alian. Kepala Bandar. Kecamatan Susoh. Kabupaten Aceh Barat Daya , KEPALA BANDAR, SUSOH, KAB. ACEH BARAT DAYA, ACEH"
PJEHNSCB,Penentuan KA SPPG,Belum Beroperasi,KAB. BONE,SULAWESI SELATAN,"poleonro kecamatan lamuru kabupaten bone, POLEONRO, LAMURU, KAB. BONE, SULAWESI SELATAN"
AVEESCGE,Penentuan KA SPPG,Belum Beroperasi,KAB. SUKABUMI,JAWA BARAT,"Jl. Kadudampit No.KM. 3, RT.16/RW.03, Gunungjaya, Kec. Cisaat, Kabupaten Sukabumi, Jawa Barat 43152, GUNUNGJAYA, CISAAT, KAB. SUKABUMI, JAWA BARAT"
5ZJ7W4QO,Penentuan KA SPPG,Belum Beroperasi,KAB. TANGGAMUS,LAMPUNG,"Jl. Taman Nasional Bukit Barisan Selatan, Pekon Tugu Papak, Kecamatan Semaka Kabupaten Tanggamus Provinsi Lampung, TUGU PAPAK, SEMAKA, KAB. TANGGAMUS, LAMPUNG"
HE1E61VC,Penentuan KA SPPG,Belum Beroperasi,KAB. LAMPUNG TIMUR,LAMPUNG,"Desa Braja Sakti, Rt. 018 Rw. 006 Kec. Way Jepara Kab.Lampung Timur Provinsi Lampung, BRAJA SAKTI, WAY JEPARA, KAB. LAMPUNG TIMUR, LAMPUNG"
FGHX2IA8,Penentuan KA SPPG,Belum Beroperasi,KAB. BANDUNG,JAWA BARAT,"Kampung Cimenteng Kelurahan Jagabaya Kecamatan Cimaung, Kabupaten Bandung, Provinsi Jawa Barat seluas , JAGABAYA, CIMAUNG, KAB. BANDUNG, JAWA BARAT"
18ONFVV4,Penentuan KA SPPG,Belum Beroperasi,KAB. BOGOR,JAWA BARAT,"Kp. Babakan Rt. 03/07 No. 99 Desa Dayeuh Kec. Cileungsi Kab. Bogor, Provinsi Jawa Barat, Dengan luas tanah 1000 m², DAYEUH, CILEUNGSI, KAB. BOGOR, JAWA BARAT"
MTYI7OME,Penentuan KA SPPG,Belum Beroperasi,KOTA TASIKMALAYA,JAWA BARAT,"Jl. Siliwangi No. 97A/B RT/RW 001/008, KAHURIPAN, TAWANG, KOTA TASIKMALAYA, JAWA BARAT"
FJUZJ2VX,Penentuan KA SPPG,Belum Beroperasi,KAB. PEKALONGAN,JAWA TENGAH,"Jalan Kuri'an Kelurahan Kwayangan, Kecamatan Kedungwuni, Kabupaten Pekalongan, KWAYANGAN, KEDUNGWUNI, KAB. PEKALONGAN, JAWA TENGAH"
KKHTJORS,Penentuan KA SPPG,Belum Beroperasi,KOTA MEDAN,SUMATERA UTARA,"Jln. STM No. 29 Kel. Suka Maju Kec. Medan Johor Kota Medan , SUKA MAJU, MEDAN JOHOR, KOTA MEDAN, SUMATERA UTARA"
2AY4XDQ7,Penentuan KA SPPG,Belum Beroperasi,KAB. SUKABUMI,JAWA BARAT,"Kp. Babakan Tipar RT 36 RW 02, CIMAHI, CICANTAYAN, KAB. SUKABUMI, JAWA BARAT"
TLUXPBQH,Penentuan KA SPPG,Belum Beroperasi,KAB. PATI,JAWA TENGAH,"Desa Ngablak 02/02 Cluwak, Pati, Jawa Tengah, NGABLAK, CLUWAK, KAB. PATI, JAWA TENGAH"
N3HAW2BQ,Penentuan KA SPPG,Belum Beroperasi,KAB. SUBANG,JAWA BARAT,"Jl Cece Zakaria Pamanukan Kab. Subang, PAMANUKAN, PAMANUKAN, KAB. SUBANG, JAWA BARAT"
JIS9GLXU,Penentuan KA SPPG,Beroperasi,KAB. TIMOR TENGAH UTARA,NUSA TENGGARA TIMUR,"Jl. A.Yani, Depan Gereja St. Yohanes Pemandi Naesleu Kefamenanu Sealatan , KEFAMENANU SELATAN, KOTA KEFAMENANU, KAB. TIMOR TENGAH UTARA, NUSA TENGGARA TIMUR"
HKUDZUR0,Penentuan KA SPPG,Belum Beroperasi,KAB. SLEMAN,DAERAH ISTIMEWA YOGYAKARTA,"Jl.Prambanan-Piyungan KM 02 Bokoharjo Prambanan Sleman DI Yogyakarta, BOKOHARJO, PRAMBANAN, KAB. SLEMAN, DAERAH ISTIMEWA YOGYAKARTA"
NZ3HPLZ5,Penentuan KA SPPG,Belum Beroperasi,KAB. GARUT,JAWA BARAT,"JL. RAYA GARUT-TASIK NO.36, NGAMPLANGSARI, CILAWU, KAB. GARUT, JAWA BARAT"
LNPRJ0OY,Penentuan KA SPPG,Belum Beroperasi,KAB. SUBANG,JAWA BARAT,"Jl. Raya Dawuan Cisampih Desa. Dawuan Kidul Kecamatan Dawuan., DAWUAN KIDUL, DAWUAN, KAB. SUBANG, JAWA BARAT"
L2M1OX91,Penentuan KA SPPG,Belum Beroperasi,KAB. LAMPUNG TIMUR,LAMPUNG,"Jl. Lintas Pantai Timur, Dusun 2 Tirto Sari, RT008 RW002, Desa Sriwangi, Kec. Way Jepara, Kab. Lampung Timur, Lampung, Kode Pos 34396, SRI WANGI, WAY JEPARA, KAB. LAMPUNG TIMUR, LAMPUNG"
UFAADREG,Penentuan KA SPPG,Belum Beroperasi,KAB. BONDOWOSO,JAWA TIMUR,"Dusun Krajan Barat Rt.001 RW.001 Desa Wonosuko Kecamatan Tamanan, WONOSUKO, TAMANAN, KAB. BONDOWOSO, JAWA TIMUR"
VOUH7O2S,Penentuan KA SPPG,Belum Beroperasi,KAB. SUBANG,JAWA BARAT,"Dusun Kertamukti Rt 06 Rw 2 Desa Jayamukti Kecamatan Blanakan Kabupaten Subang, JAYAMUKTI, BLANAKAN, KAB. SUBANG, JAWA BARAT"
PPLWTNDT,Penentuan KA SPPG,Belum Beroperasi,KOTA BANDA ACEH,ACEH,"J. T. Nyak Arief Lr. Tunggai 3 No. 5
, LAMGUGOB, SYIAH KUALA, KOTA BANDA ACEH, ACEH"
CNOQDZXF,Penentuan KA SPPG,Belum Beroperasi,KAB. BIREUEN,ACEH,"Meunasah Pulo, MEUNASAH PULO, PEUDADA, KAB. BIREUEN, ACEH"
ZGCTCFHY,Penentuan KA SPPG,Belum Beroperasi,KAB. LAMPUNG TIMUR,LAMPUNG,"desa braja mulya kecamatan braja selebah kabupaten lampung timur, BRAJA MULYA, BRAJA SELEBAH, KAB. LAMPUNG TIMUR, LAMPUNG"
WMDZ1R1G,Penentuan KA SPPG,Belum Beroperasi,KAB. PIDIE,ACEH,"Mee Lampoih Saka, Desa dua paya, DUA PAYA, PEUKAN BARO, KAB. PIDIE, ACEH"
V42WY8UZ,Penentuan KA SPPG,Belum Beroperasi,KAB. PIDIE JAYA,ACEH,"Gampong Meugit Sagoe Jl. Medan Banda Aceh, Muko Buloh
, MEUGIT SAGOE, BANDAR DUA, KAB. PIDIE JAYA, ACEH"
S6EEESLQ,Penentuan KA SPPG,Belum Beroperasi,KAB. ACEH UTARA,ACEH,"Gampong Mane Kawan
, MANE KAWAN, SEUNUDDON, KAB. ACEH UTARA, ACEH"
LXRAG7CB,Penentuan KA SPPG,Belum Beroperasi,KAB. BENER MERIAH,ACEH,"JL. BANDARA REMBELE NO. 10, REMBELE, BUKIT, KAB. BENER MERIAH, ACEH"
0U9KO5GN,Penentuan KA SPPG,Belum Beroperasi,KOTA LANGSA,ACEH,"Jl. Alkahar Gampong Daulat Kota Langsa, DAULAT, LANGSA KOTA, KOTA LANGSA, ACEH"
VS4KGDNN,Penentuan KA SPPG,Belum Beroperasi,KAB. SUBANG,JAWA BARAT,"Jl. Pertigaan Mande Kp. Citalutug RT. 018 RW. 006, SAGALAHERANG KALER, SAGALAHERANG, KAB. SUBANG, JAWA BARAT"
SALIOEMM,Penentuan KA SPPG,Belum Beroperasi,KAB. WAJO,SULAWESI SELATAN,"Jl. Andi Oddang Desa watang Rumpia Kecamatan Majauleng, WATANRUMPIA, MAJAULENG, KAB. WAJO, SULAWESI SELATAN"
QIBNJJKJ,Penentuan KA SPPG,Belum Beroperasi,KAB. LOMBOK TENGAH,NUSA TENGGARA BARAT,"Desa Sukaraja, SUKARAJA, PRAYA TIMUR, KAB. LOMBOK TENGAH, NUSA TENGGARA BARAT"
OPIOERIA,Penentuan KA SPPG,Belum Beroperasi,KAB. ENREKANG,SULAWESI SELATAN,"Sangeran, Desa Mampu Kecamatan Anggeraja Kab. Enrekang Provinsi Sulwesi Selatan 91752, MAMPU, ANGGERAJA, KAB. ENREKANG, SULAWESI SELATAN"
XQYEJWCE,Penentuan KA SPPG,Belum Beroperasi,KAB. CIREBON,JAWA BARAT,"Blok Kidul RT.003/001 Desa. Karangreja Kec.Suranenggala Kabupaten. Cirebon
, KARANGREJA, SURANENGGALA, KAB. CIREBON, JAWA BARAT"
3GPXULKS,Penentuan KA SPPG,Belum Beroperasi,KAB. CIREBON,JAWA BARAT,"Dusun 1 Rt 001/002 Desa Sedong Kidul Kec. Sedong Kab. Cirebon
, SEDONG KIDUL, SEDONG, KAB. CIREBON, JAWA BARAT"
9KULCCYA,Penentuan KA SPPG,Belum Beroperasi,KAB. BONDOWOSO,JAWA TIMUR,"Rt 25 Rw 07 Dusun Krajan lama, desa gunung anyar, kec tapen, Bondowoso 68283, GUNUNG ANYAR, TAPEN, KAB. BONDOWOSO, JAWA TIMUR"
UVGXMMRA,Penentuan KA SPPG,Belum Beroperasi,KAB. LAMPUNG SELATAN,LAMPUNG,"Jl. Raya Serdang Tanjung Bintang, SERDANG, TANJUNG BINTANG, KAB. LAMPUNG SELATAN, LAMPUNG"
L9ALLQTF,Penentuan KA SPPG,Belum Beroperasi,KOTA BANDUNG,JAWA BARAT,"Jl. Setrawangi Selatan I No.1, SUKAGALIH, SUKAJADI, KOTA BANDUNG, JAWA BARAT"
GECJRQX7,Penentuan KA SPPG,Belum Beroperasi,KAB. BANDUNG,JAWA BARAT,"Pesona Ciganitri Blok A No 55 Desa Cipagalo, Kec. Bojongsoang, Kab. Bandung, CIPAGALO, BOJONGSOANG, KAB. BANDUNG, JAWA BARAT"
NCQ6FPDX,Penentuan KA SPPG,Belum Beroperasi,KAB. BEKASI,JAWA BARAT,"Jl. Barokah, TELAJUNG, CIKARANG BARAT, KAB. BEKASI, JAWA BARAT"
F69E04LU,Penentuan KA SPPG,Belum Beroperasi,KOTA BANDUNG,JAWA BARAT,"Jl. Ciwastra No. 189 RT 006 RW 008
Kel. Mekarjaya
Kec. Rancasari
Kota Bandung, MEKARMULYA, RANCASARI, KOTA BANDUNG, JAWA BARAT"
ECRUGSZG,Penentuan KA SPPG,Belum Beroperasi,KAB. SUKABUMI,JAWA BARAT,"Jl. Cikiray Kidul, Sukamanah, Kec. Cisaat, Kabupaten Sukabumi, Jawa Barat 43152, SUKAMANAH, CISAAT, KAB. SUKABUMI, JAWA BARAT"
NCRDN0OE,Penentuan KA SPPG,Belum Beroperasi,KAB. BANDUNG BARAT,JAWA BARAT,"Jl. Permata Cimahi Blok A No. 7 RT.005 RW.012, TANIMULYA, NGAMPRAH, KAB. BANDUNG BARAT, JAWA BARAT"
JKU3XYCZ,Penentuan KA SPPG,Belum Beroperasi,KAB. BOJONEGORO,JAWA TIMUR,"Rt 03 Rw 01 Desa pejambon Kecamatan Sumberrejo Kabupaten Bojonegoro Provinsi Jawa Timur, PEJAMBON, SUMBEREJO, KAB. BOJONEGORO, JAWA TIMUR"
DI8FJJCI,Penentuan KA SPPG,Belum Beroperasi,KAB. MUSI BANYUASIN,SUMATERA SELATAN,"DUSUN III DESA PETALING, PETALING, LAIS, KAB. MUSI BANYUASIN, SUMATERA SELATAN"
7QPAO2BX,Penentuan KA SPPG,Belum Beroperasi,KAB. PINRANG,SULAWESI SELATAN,"Jl.ir Juanda no, Watang Sawitto kabupaten Pinrang, MACCORAWALIE, WATANG SAWITTO, KAB. PINRANG, SULAWESI SELATAN"
PDQ7WJY4,Penentuan KA SPPG,Belum Beroperasi,KAB. SUBANG,JAWA BARAT,"Jl. Raya Rancasari KM.4 RT.10 / RW.4 Ds. Rancasari Kec. Pamanukan Kab. Subang Kode Pos. 41254, RANCASARI, PAMANUKAN, KAB. SUBANG, JAWA BARAT"
W7GGATB6,Penentuan KA SPPG,Belum Beroperasi,KAB. KEPULAUAN SELAYAR,SULAWESI SELATAN,"Jl. Krg Senrang No.32 A, Batangmata, Kec. Bontomatene, Kab. Kepulauan Selayar, Sulawesi Selatan, BATANGMATA, BONTOMATENE, KAB. KEPULAUAN SELAYAR, SULAWESI SELATAN"
PYZMFZ1I,Penentuan KA SPPG,Belum Beroperasi,KAB. PANGKAJENE KEPULAUAN,SULAWESI SELATAN,"Jl. poros biring kassi, SAMALEWA, BUNGORO, KAB. PANGKAJENE KEPULAUAN, SULAWESI SELATAN"
