ID_SPPG,Status_Pengajuan,Status_Operasional,Kota_Kabupaten,Provinsi,Alamat
X6ODL31Z,Penentuan KA SPPG,Belum Beroperasi,KOTA DEPOK,JAWA BARAT,"JL. SUMUR BANDUNG I RT. 001 / 002 HARJAMUKTI , CIMANGGIS DEPOK JAWA BARAT, HARJAMUKTI, CIMANGGIS, KOTA DEPOK, JAWA BARAT"
LFJR6QLC,Penentuan KA SPPG,Belum Beroperasi,KAB. CIANJUR,JAWA BARAT,"Jalan Perwira no 02 A RT/RW 002/005 Kelurahan Sawahgede Kecamatan Cianjur Kabupaten Cianjur 43212, SAWAHGEDE, CIANJUR, KAB. CIANJUR, JAWA BARAT"
6VC1CXXW,Penentuan KA SPPG,Belum Beroperasi,KAB. BOGOR,JAWA BARAT,"Kp.Tonggoh Rt.005 / 01 No.5 Desa Gunungsari Kec. Citeureup, GUNUNGSARI, CITEUREUP, KAB. BOGOR, JAWA BARAT"
ZK830KWS,Penentuan KA SPPG,Belum Beroperasi,KOTA BANDAR LAMPUNG,LAMPUNG,"Jl. ZA.Pagar Alam no. 12, RAJABASA, RAJABASA, KOTA BANDAR LAMPUNG, LAMPUNG"
CJJ8GQUR,Penentuan KA SPPG,Belum Beroperasi,KOTA SALATIGA,JAWA TENGAH,"RT.02/RW.08 Kel. Ledok, Kec. Argomulyo, Kota Salatiga, LEDOK, ARGOMULYO, KOTA SALATIGA, JAWA TENGAH"
9Y9RELWL,Penentuan KA SPPG,Belum Beroperasi,KOTA BANDAR LAMPUNG,LAMPUNG,"Jl. Harapan Komplek Cemara Indah No.01 , LABUHAN RATU RAYA, LABUHAN RATU, KOTA BANDAR LAMPUNG, LAMPUNG"
6TELDM1W,Penentuan KA SPPG,Belum Beroperasi,KAB. LAMPUNG UTARA,LAMPUNG,"Jln. Merpati 1, kel. Tanjung Harapan Kecamatan Kotabumi Selatan. Kabupaten  Lampung Utara LAMPUNG, TANJUNGHARAPAN, KOTABUMI SELATAN, KAB. LAMPUNG UTARA, LAMPUNG"
LLFNARIY,Penentuan KA SPPG,Belum Beroperasi,KAB. GUNUNGKIDUL,DAERAH ISTIMEWA YOGYAKARTA,"Siyono Kidul, RT 042 RW 08, Logandeng, Playen, Gunungkidul, D.I. Yogyakarta., LOGANDENG, PLAYEN, KAB. GUNUNGKIDUL, DAERAH ISTIMEWA YOGYAKARTA"
EBSH84NP,Penentuan KA SPPG,Belum Beroperasi,KAB. KENDAL,JAWA TENGAH,"Jl. MliwisNo.1 Rt.003 Rw.006,  Purwokerto, Kec. Patebon, Kabupaten Kendal, Jawa Tengah 51351, PURWOKERTO, PATEBON, KAB. KENDAL, JAWA TENGAH"
H2EOJ7P0,Penentuan KA SPPG,Belum Beroperasi,KOTA BANDAR LAMPUNG,LAMPUNG,"Jl. Sultan Agung gg. Bangsawan No. 46 A, SEPANG JAYA, LABUHAN RATU, KOTA BANDAR LAMPUNG, LAMPUNG"
SMSXE1UU,Penentuan KA SPPG,Belum Beroperasi,KAB. KENDAL,JAWA TENGAH,"Dusun Padolengan RT 05, RW 06, Desa Mororejo, Kec. Kaliwungu, Kab. Kendal, Jawa Tengah., MOROREJO, KALIWUNGU, KAB. KENDAL, JAWA TENGAH"
BPZPLTNB,Penentuan KA SPPG,Belum Beroperasi,KOTA YOGYAKARTA,DAERAH ISTIMEWA YOGYAKARTA,"Jalan Arjuna No. 30, Wirobrajan, Kota Yogyakarta, Daerah Istimewa Yogyakarta, WIROBRAJAN, WIROBRAJAN, KOTA YOGYAKARTA, DAERAH ISTIMEWA YOGYAKARTA"
JLHGLTP2,Penentuan KA SPPG,Belum Beroperasi,KAB. SERANG,BANTEN,"Jl Lingkar Luar RT 02 RW 06 Kel Serdang Kec Kramatwatu Kabupaten Serang, SERDANG, KRAMATWATU, KAB. SERANG, BANTEN"
VVV5Z4A1,Penentuan KA SPPG,Belum Beroperasi,KAB. KEDIRI,JAWA TIMUR,"Jalan Raya Mojo, Tamansari, Desa Kranding, Kecamatan Mojo Kab Kediri Jawq Timur, KRANDING, MOJO, KAB. KEDIRI, JAWA TIMUR"
2LURDAMN,Penentuan KA SPPG,Belum Beroperasi,KOTA MEDAN,SUMATERA UTARA,"Jalan Bunga Stella 1 No.76A, SIMPANG SELAYANG, MEDAN TUNTUNGAN, KOTA MEDAN, SUMATERA UTARA"
V15VWKYW,Penentuan KA SPPG,Belum Beroperasi,KAB. BREBES,JAWA TENGAH,"Beber dukuh RT 001. RW 001, CIGADUNG, BANJARHARJO, KAB. BREBES, JAWA TENGAH"
KHB8KRWK,Penentuan KA SPPG,Belum Beroperasi,KAB. LOMBOK UTARA,NUSA TENGGARA BARAT,"Jalan Raya Tanjung-Bayan Dusun Lendang Mamben Desa Anyar Kecamatan Bayan Kabupaten Lombok Utara, NTB, ANYAR, BAYAN, KAB. LOMBOK UTARA, NUSA TENGGARA BARAT"
ICRN66YT,Penentuan KA SPPG,Belum Beroperasi,KOTA TASIKMALAYA,JAWA BARAT,"Jl. Bojong Nangka, SUKAMENAK, PURBARATU, KOTA TASIKMALAYA, JAWA BARAT"
QPJGHPAY,Penentuan KA SPPG,Belum Beroperasi,KAB. BOGOR,JAWA BARAT,"Jl. Cendrawasih No. 21, Kel. Tajurhalang, Kec. Tajurhalang, Kabupaten Bogor, Kode Pos : 16320, Jawa Barat, TAJURHALANG, TAJURHALANG, KAB. BOGOR, JAWA BARAT"
PFYNJ1D6,Penentuan KA SPPG,Belum Beroperasi,KOTA SURABAYA,JAWA TIMUR,"JL. SIDOSERMO III NO. 44, SIDOSERMO, WONOCOLO, KOTA SURABAYA, JAWA TIMUR"
LKPGIYHN,Penentuan KA SPPG,Belum Beroperasi,KAB. PELALAWAN,RIAU,"Jl. Abd. Rahman, LUBUK TERAP, BANDAR PETALANGAN, KAB. PELALAWAN, RIAU"
8OEXK6CA,Penentuan KA SPPG,Belum Beroperasi,KOTA JAYAPURA,PAPUA,"KOMPLEKS EKS BATIK YDF RT 002 RW 001 KEL.YABANSAI WAENA KOTA JAYAPURA, YABANSAI, HERAM, KOTA JAYAPURA, PAPUA"
OTPGIRFL,Penentuan KA SPPG,Belum Beroperasi,KAB. BENGKALIS,RIAU,"Jl. Asrama Tribrata Gg Lumayan RT 003 RW 008 Kelurahan Pematang Pudu Kecamatan Mandau Kabupaten Bengkalis, PEMATANG PUDU, MANDAU, KAB. BENGKALIS, RIAU"
ILGHDAXG,Penentuan KA SPPG,Belum Beroperasi,KAB. KUDUS,JAWA TENGAH,"Jalan Ngasinan, Purworejo, Panjang, Bae, Kudus, PURWOREJO, BAE, KAB. KUDUS, JAWA TENGAH"
TKKLJCFG,Penentuan KA SPPG,Belum Beroperasi,KAB. NGANJUK,JAWA TIMUR,"Jalan Raya, Talun, Gondang, Talun, Kec Rejoso, Kab Nganjuk, Jawa Timur, TALUN, REJOSO, KAB. NGANJUK, JAWA TIMUR"
ZRXGYY04,Penentuan KA SPPG,Belum Beroperasi,KAB. OGAN KOMERING ULU TIMUR,SUMATERA SELATAN,"Jln. Lintas Betung-Petanggan, Ancak, Ds. Tanjung Kukuh, Kec. Semendawai Barat, TANJUNG KUKUH, SEMENDAWAI BARAT, KAB. OGAN KOMERING ULU TIMUR, SUMATERA SELATAN"
JAEVMM2L,Penentuan KA SPPG,Belum Beroperasi,KOTA BANDAR LAMPUNG,LAMPUNG,"Jalan Khairil Anwar Kelurahan Durian Payung Kecamatan Tanjung Karang Pusat Kota Bandar Lampung Provinsi Lampung, DURIAN PAYUNG, TANJUNGKARANG PUSAT, KOTA BANDAR LAMPUNG, LAMPUNG"
JLY1SKNK,Penentuan KA SPPG,Belum Beroperasi,KAB. MAJALENGKA,JAWA BARAT,"BLOK CISAMPIH RT.003 RW.001 DESA SUKAPERNA KECAMATAN TALAGA KABUPATEN MAJALENGKA 45463, SUKAPERNA, TALAGA, KAB. MAJALENGKA, JAWA BARAT"
VEEOJ1X6,Penentuan KA SPPG,Belum Beroperasi,KAB. MUSI RAWAS UTARA,SUMATERA SELATAN,"Rt 01 no: 68   , PASAR SURULANGUN, RAWAS ULU, KAB. MUSI RAWAS UTARA, SUMATERA SELATAN"
LNYX0YAX,Penentuan KA SPPG,Belum Beroperasi,KAB. TULANG BAWANG,LAMPUNG,"Jl. Ethanol, Tunggal Warga, Kec. Banjar Agung, Kab. Tulang Bawang, Lampung , TUNGGAL WARGA, BANJAR AGUNG, KAB. TULANG BAWANG, LAMPUNG"
BSE6NL0K,Penentuan KA SPPG,Belum Beroperasi,KOTA ADM. JAKARTA SELATAN,DKI JAKARTA,"Jl. Tanah Kusir IV No.60 RT 002 RW 009, KEBAYORAN LAMA SELATAN, KEBAYORAN LAMA, KOTA ADM. JAKARTA SELATAN, DKI JAKARTA"
8OPOYTHQ,Penentuan KA SPPG,Belum Beroperasi,KOTA BEKASI,JAWA BARAT,"Perum Duta Kranji, Jln Prambanan Raya Blok A 795, RT 10/Rw.10, BINTARA, BEKASI BARAT, KOTA BEKASI, JAWA BARAT"
SI0KFWKE,Penentuan KA SPPG,Belum Beroperasi,KAB. LOMBOK TIMUR,NUSA TENGGARA BARAT,"Jl. Raya Anjani, Desa Gapuk, Kec. Suralaga, Kab. Lombok Timur, Prov. Nusa Tenggara Barat, GAPUK, SURALAGA, KAB. LOMBOK TIMUR, NUSA TENGGARA BARAT"
6UA2X6CA,Penentuan KA SPPG,Belum Beroperasi,KAB. CIAMIS,JAWA BARAT,"JL ir H juanda  no 18 A Sikuraja Linggasari kecamatan Ciamis, LINGGASARI, CIAMIS, KAB. CIAMIS, JAWA BARAT"
DM5UU4I8,Penentuan KA SPPG,Belum Beroperasi,KAB. MUSI RAWAS UTARA,SUMATERA SELATAN,"Desa Tebing tinggi , TEBING TINGGI, NIBUNG, KAB. MUSI RAWAS UTARA, SUMATERA SELATAN"
5NI6JSJO,Penentuan KA SPPG,Belum Beroperasi,KAB. BANDUNG BARAT,JAWA BARAT,"Cilame Indah RT 07 RW 20 desa Cilame  KECAMATAN NGAMPRAH No B199. Kampung ciharascas KAB. BANDUNG BARAT, CILAME, NGAMPRAH, KAB. BANDUNG BARAT, JAWA BARAT"
XDP1XGUJ,Penentuan KA SPPG,Belum Beroperasi,KAB. MESUJI,LAMPUNG,"Desa Tanjung mas makmur rt 06/01, TANJUNG MAS MAKMUR, MESUJI TIMUR, KAB. MESUJI, LAMPUNG"
ZM9Q3YT7,Penentuan KA SPPG,Belum Beroperasi,KOTA BIMA,NUSA TENGGARA BARAT,"Jl. Tendean 3  Kel. Mande Kec. Mpunda Kota Bima 
, MANDE, MPUNDA, KOTA BIMA, NUSA TENGGARA BARAT"
J3MBOMHJ,Penentuan KA SPPG,Belum Beroperasi,KAB. SUPIORI,PAPUA,"JL.RAYA SORENDIWERI-KAMP.SORENDIDORI, SORENDIDORI, SUPIORI TIMUR, KAB. SUPIORI, PAPUA"
OXDHEI7E,Penentuan KA SPPG,Belum Beroperasi,KAB. GUNUNGKIDUL,DAERAH ISTIMEWA YOGYAKARTA,"Jl. Taman Bakti RT 05 RW 22  Dusun Jeruksari Kec. Wonosari. Kab. Gunungkidul , WONOSARI, WONOSARI, KAB. GUNUNGKIDUL, DAERAH ISTIMEWA YOGYAKARTA"
2JECJRIS,Penentuan KA SPPG,Belum Beroperasi,KAB. TULANG BAWANG BARAT,LAMPUNG,"Desa Agong jaya RT/RW 03/001 
, AGUNG JAYA, WAY KENANGA, KAB. TULANG BAWANG BARAT, LAMPUNG"
C3VIMTFO,Penentuan KA SPPG,Belum Beroperasi,KAB. BOYOLALI,JAWA TENGAH,"GLAGAHOMBO RT 14 RW 04, BLUMBANG, KLEGO, KAB. BOYOLALI, JAWA TENGAH"
MBZUPZOR,Penentuan KA SPPG,Belum Beroperasi,KAB. OGAN ILIR,SUMATERA SELATAN,"Jl. Kerio Bijak, Payaraman Barat, Kec. Payaraman, Kabupaten Ogan Ilir, Sumatera Selatan, PAYARAMAN BARAT, PAYARAMAN, KAB. OGAN ILIR, SUMATERA SELATAN"
FPAA1OFC,Penentuan KA SPPG,Belum Beroperasi,KAB. CIANJUR,JAWA BARAT,"JL. CIKANCANA, KP. CIKANCANA, RT 11 / RW 04, CIKANCANA, GEKBRONG, KAB. CIANJUR, JAWA BARAT"
W0KFAQIW,Penentuan KA SPPG,Belum Beroperasi,KAB. MESUJI,LAMPUNG,"Jln. Pasar kedung, rt 01 rw 06, GEDUNG BOGA, WAY SERDANG, KAB. MESUJI, LAMPUNG"
ZKCUXXV8,Penentuan KA SPPG,Belum Beroperasi,KAB. MESUJI,LAMPUNG,"Jln Raden Intan mukti karya panca jaya mesuji, MUKTI KARYA, PANCA JAYA, KAB. MESUJI, LAMPUNG"
TPHOPSCC,Penentuan KA SPPG,Belum Beroperasi,KAB. MALANG,JAWA TIMUR,"JLN BRIGJEN ABD MANAN NO 29 DESA NGROTO KECAMATAN PUJON KABUPATEN MALANG, NGROTO, PUJON, KAB. MALANG, JAWA TIMUR"
LM1LQKCP,Penentuan KA SPPG,Belum Beroperasi,KAB. MESUJI,LAMPUNG,"Desa buko poso way serdang mesuji, BUKO POSO, WAY SERDANG, KAB. MESUJI, LAMPUNG"
AGUMEWZY,Penentuan KA SPPG,Belum Beroperasi,KAB. LAMPUNG TIMUR,LAMPUNG,"Jl Harjo sudarmo/rt 12 rw 03, BUMI HARJO, BATANGHARI, KAB. LAMPUNG TIMUR, LAMPUNG"
5MYWLPL6,Penentuan KA SPPG,Belum Beroperasi,KOTA TASIKMALAYA,JAWA BARAT,"Jalan Siliwangi No. 29, CIKALANG, TAWANG, KOTA TASIKMALAYA, JAWA BARAT"
VGQ5DSBO,Penentuan KA SPPG,Belum Beroperasi,KAB. DHARMASRAYA,SUMATERA BARAT,"Blok E Jorong 2 Rumah Mbak Apri, TIUMANG, TIUMANG, KAB. DHARMASRAYA, SUMATERA BARAT"
GS14V4X4,Penentuan KA SPPG,Belum Beroperasi,KOTA TASIKMALAYA,JAWA BARAT,"Kampung Warung Bandung, SETIANAGARA, CIBEUREUM, KOTA TASIKMALAYA, JAWA BARAT"
Y8HRC5E9,Penentuan KA SPPG,Belum Beroperasi,KOTA PARIAMAN,SUMATERA BARAT,"Jalan Imam Bonjol No. 10, ALAI GELOMBANG, PARIAMAN TENGAH, KOTA PARIAMAN, SUMATERA BARAT"
JO3ZCEYO,Penentuan KA SPPG,Belum Beroperasi,KOTA PALANGKARAYA,KALIMANTAN TENGAH,"Jl. Bukit Kenanga No.09, PALANGKA, JEKAN RAYA, KOTA PALANGKARAYA, KALIMANTAN TENGAH"
FVMU3KRI,Penentuan KA SPPG,Belum Beroperasi,KAB. TASIKMALAYA,JAWA BARAT,"kp. lampegan rt 003 rw 009 ds nangewer kec pagerageung kab. tasikmalaya, NANGGEWER, PAGERAGEUNG, KAB. TASIKMALAYA, JAWA BARAT"
GISDGMEI,Penentuan KA SPPG,Belum Beroperasi,KOTA JAYAPURA,PAPUA,"Jln Ruko Pasifik Permai Dok 2 Jayapura Papua, BAYANGKARA, JAYAPURA UTARA, KOTA JAYAPURA, PAPUA"
OZ6NFUJW,Penentuan KA SPPG,Belum Beroperasi,KAB. TULUNGAGUNG,JAWA TIMUR,"JL. Raya Sumbergempol No.26 RT 01/ RW 01, Sumberdadi, Sumbergempol,
 Tulungagung Jawa Timur, SUMBERDADI, SUMBERGEMPOL, KAB. TULUNGAGUNG, JAWA TIMUR"
ZCYMI0AK,Penentuan KA SPPG,Belum Beroperasi,KOTA MEDAN,SUMATERA UTARA,"JL. SETIA BUDI PASAR II NO.46, TANJUNGSARI, MEDAN SELAYANG, KOTA MEDAN, SUMATERA UTARA"
VOVPCMLH,Penentuan KA SPPG,Belum Beroperasi,KOTA DEPOK,JAWA BARAT,"Jalan Bujkit Duta 1, TUGU, CIMANGGIS, KOTA DEPOK, JAWA BARAT"
O39PKUM7,Penentuan KA SPPG,Belum Beroperasi,KAB. KUNINGAN,JAWA BARAT,"JLN.SMP NEGERI 1 DESA NO 38 BOJONG, KEC.CILIMUS, KAB.KUNINGAN, BOJONG, CILIMUS, KAB. KUNINGAN, JAWA BARAT"
ZNSU3K6J,Penentuan KA SPPG,Belum Beroperasi,KAB. DOMPU,NUSA TENGGARA BARAT,"Jl. Ompu Buncu Desa Matua Kecamatan Woja Kabupaten Dompu, MATUA, WOJA, KAB. DOMPU, NUSA TENGGARA BARAT"
WPIGAKXV,Penentuan KA SPPG,Belum Beroperasi,KOTA SURABAYA,JAWA TIMUR,"Jl. Pondok Benowo Indah BLOK XX 9
SURABAYA, BABAT JERAWAT, PAKAL, KOTA SURABAYA, JAWA TIMUR"
GQAX7PLV,Penentuan KA SPPG,Belum Beroperasi,KAB. BANDUNG BARAT,JAWA BARAT,"KP. Baru RT 003 RW 001, Desa cigugur girang, kec. Parongpong, kab. Bandung barat, CIGUGURGIRANG, PARONGPONG, KAB. BANDUNG BARAT, JAWA BARAT"
OZFQ6HA2,Penentuan KA SPPG,Belum Beroperasi,KAB. BANDUNG BARAT,JAWA BARAT,"Jl. Maribaya No.99, Langensari, Kec. Lembang, Kabupaten Bandung Barat, Jawa Barat 40391
, LANGENSARI, LEMBANG, KAB. BANDUNG BARAT, JAWA BARAT"
8FGHTMEI,Penentuan KA SPPG,Belum Beroperasi,KAB. KEBUMEN,JAWA TENGAH,"TLOGO KULON RT.02 RW.02, TLOGOPRAGOTO, MIRIT, KAB. KEBUMEN, JAWA TENGAH"
VBVQPJ2B,Penentuan KA SPPG,Belum Beroperasi,KAB. SERANG,BANTEN,"Kp. Marapit Ds. Tamiang Gunungsari, TAMIANG, GUNUNGSARI, KAB. SERANG, BANTEN"
TQRXSKFN,Penentuan KA SPPG,Belum Beroperasi,KAB. SUMENEP,JAWA TIMUR,"JL. RAYA GULUK GULUK – PRENDUAN  Dusun Pesisir RT 002 RW 001, PRENDUAN, PRAGAAN, KAB. SUMENEP, JAWA TIMUR"
GPUXASQN,Penentuan KA SPPG,Belum Beroperasi,KAB. PADANG LAWAS UTARA,SUMATERA UTARA,"Jl.sibuhuan-gunung tua,aloban. Ds.portibi Jae Kec.Portibi Kab.Padang Lawas Utara 
Provinsi Sumatera Utara, PORTIBI JAE, PORTIBI, KAB. PADANG LAWAS UTARA, SUMATERA UTARA"
R47GEQ1G,Penentuan KA SPPG,Belum Beroperasi,KAB. SIDENRENG RAPPANG,SULAWESI SELATAN,"Jl. Poros Pare-pare - Rappang, Kel. Panreng, Kec. Baranti, Kab. Sidenreng Rappang, Prov. Sulawesi Selatan, PANRENG , BARANTI, KAB. SIDENRENG RAPPANG, SULAWESI SELATAN"
JADQHJ9V,Penentuan KA SPPG,Belum Beroperasi,KAB. TRENGGALEK,JAWA TIMUR,"Jalan Kanjengan Dusun Guyah Gajah, Desa Kamulan, Kec. Durenan, Kabupaten Trenggalek, Jawa Timur 66381, KAMULAN, DURENAN, KAB. TRENGGALEK, JAWA TIMUR"
YFDHBRX3,Penentuan KA SPPG,Belum Beroperasi,KAB. BLORA,JAWA TENGAH,"Jalan Seso - Sayuran, Desa Seso, Kecamatan Jepon, Kabupaten blora, SESO, JEPON, KAB. BLORA, JAWA TENGAH"
KPKBSD9U,Penentuan KA SPPG,Belum Beroperasi,KAB. BOGOR,JAWA BARAT,"KP. Karehkel Rt.001 Rw. 003, PINGKU, PARUNG PANJANG, KAB. BOGOR, JAWA BARAT"
6W0GBQOY,Penentuan KA SPPG,Belum Beroperasi,KOTA YOGYAKARTA,DAERAH ISTIMEWA YOGYAKARTA,"Jl Tegalturi UH VII No.116 RT.11 RW.04 Giwangan Umbulharjo Yogyakarta, GIWANGAN, UMBULHARJO, KOTA YOGYAKARTA, DAERAH ISTIMEWA YOGYAKARTA"
EA6WKLEX,Penentuan KA SPPG,Belum Beroperasi,KAB. KEBUMEN,JAWA TENGAH,"Jl. Daendels No. 11 RT 000 RW 000 Desa Banjarejo, BANJAREJO, PURING, KAB. KEBUMEN, JAWA TENGAH"
4NCMLYEN,Penentuan KA SPPG,Belum Beroperasi,KOTA SERANG,BANTEN,"Perum. Serang Hijau Blok G4 Kel. Banjarsari Kec. Cipocok Jaya, Kota Serang, Prov. Banten., BANJARSARI, CIPOCOK JAYA, KOTA SERANG, BANTEN"
QFAEPSHQ,Penentuan KA SPPG,Belum Beroperasi,KAB. MINAHASA,SULAWESI UTARA,"Pinabetengan Utara, PINABETENGAN UTARA, TOMPASO BARAT, KAB. MINAHASA, SULAWESI UTARA"
EWKDX7CQ,Penentuan KA SPPG,Belum Beroperasi,KAB. KEDIRI,JAWA TIMUR,"Jl. Raya Banyakan No.200, Ds. Bakalan, Kec. Grogol, Kabupaten Kediri, Jawa Timur 64151, BAKALAN, GROGOL, KAB. KEDIRI, JAWA TIMUR"
KBKSLEGU,Penentuan KA SPPG,Belum Beroperasi,KAB. JOMBANG,JAWA TIMUR,"Dsn. Beji RT002/RW001, Sawiji, Kec. Jogoroto, Kab. Jombang, Jawa Timur, SAWIJI, JOGOROTO, KAB. JOMBANG, JAWA TIMUR"
MH2WEY7M,Penentuan KA SPPG,Belum Beroperasi,KAB. HALMAHERA SELATAN,MALUKU UTARA,"Desa Tembal, Kecamatan Bacan Selatan, TEMBAL, BACAN SELATAN, KAB. HALMAHERA SELATAN, MALUKU UTARA"
CN1SKJFL,Penentuan KA SPPG,Belum Beroperasi,KAB. TEMANGGUNG,JAWA TENGAH,"Dusun Nglarang I Rt 07 Rw 03 Mangunsari, Ngadirejo, Temanggung Jawa Tengah., MANGUNSARI, NGADIREJO, KAB. TEMANGGUNG, JAWA TENGAH"
EDBCL4AZ,Penentuan KA SPPG,Belum Beroperasi,KAB. KEBUMEN,JAWA TENGAH,"DESA BALINGASAL KEC PADURESO KAB KEBUMEN JATENG, BALINGASAL, PADURESO, KAB. KEBUMEN, JAWA TENGAH"
LH3NGGIQ,Penentuan KA SPPG,Belum Beroperasi,KAB. LEBAK,BANTEN,"KP. JAYAMUKTI RT.002 RW.003, WANASALAM, WANASALAM, KAB. LEBAK, BANTEN"
DAGXB34L,Penentuan KA SPPG,Belum Beroperasi,KAB. BOGOR,JAWA BARAT,"Perumahan Gunung Putri Jalan Nanas IV, Desa/Kelurahan Karanggan, Kec. Gunung Putri, Kab Bogor, Provinsi Jawa Barat, KARANGGAN, GUNUNG PUTRI, KAB. BOGOR, JAWA BARAT"
FWSKHWUI,Penentuan KA SPPG,Belum Beroperasi,KAB. BUOL,SULAWESI TENGAH,"DESA BUNOBOGU SELATAN, RT 009 RW 005 DUSUN I, KEC. BUNOBOGU, KAB. BUOL, BUNOBOGU SELATAN, BUNOBOGU, KAB. BUOL, SULAWESI TENGAH"
VMQNTFPK,Penentuan KA SPPG,Belum Beroperasi,KAB. JOMBANG,JAWA TIMUR,"Jl raya menganto rt 2 rw 1, ngepung, selorejo, kec mojowarno, kab jombang jawa timur, SELOREJO, MOJOWARNO, KAB. JOMBANG, JAWA TIMUR"
EDYCYYXV,Penentuan KA SPPG,Belum Beroperasi,KOTA MAKASSAR,SULAWESI SELATAN,"Jalan RSI Faisal Raya No.9 B-C, Desa/Kelurahan Banta-Bantaeng, Kec., BANTA-BANTAENG, RAPPOCINI, KOTA MAKASSAR, SULAWESI SELATAN"
MTK5HOVP,Penentuan KA SPPG,Belum Beroperasi,KAB. MAGELANG,JAWA TENGAH,"Dusun Nuren RT.006 RW.002 Desa Purwosari Kecamatan Tegalrejo Kabupaten Magelang Provinsi Jawa Tengah Kode Pos 56192, PURWOSARI, TEGALREJO, KAB. MAGELANG, JAWA TENGAH"
LLXBQCTW,Penentuan KA SPPG,Belum Beroperasi,KOTA SURAKARTA,JAWA TENGAH,"Jl. Dr. Wahidin No.53  Penumping Kec. Laweyan, Kota Surakarta, PENUMPING, LAWEYAN, KOTA SURAKARTA, JAWA TENGAH"
NLBGB3QR,Penentuan KA SPPG,Belum Beroperasi,KAB. TRENGGALEK,JAWA TIMUR,"RT. 07 RW. 02 Dusun Ngarejo, Ds. Ngulungkulon, Kec, Munjungan, NGULUNGKULON, MUNJUNGAN, KAB. TRENGGALEK, JAWA TIMUR"
RSJNWA6E,Penentuan KA SPPG,Belum Beroperasi,KAB. REJANG LEBONG,BENGKULU,"Jalan Iskandar Ong RT.009 RW.003 No 43 Talang Rimbo Baru Kec. Curup Tengah Kab. Rejang Lebong, TALANG RIMBO BARU, CURUP TENGAH, KAB. REJANG LEBONG, BENGKULU"
OCGSTA4B,Penentuan KA SPPG,Belum Beroperasi,KAB. LEBAK,BANTEN,"Kp. Ciputat RT 004 RW 001, PASAR KEONG, CIBADAK, KAB. LEBAK, BANTEN"
BS4CVFCF,Penentuan KA SPPG,Belum Beroperasi,KAB. NGANJUK,JAWA TIMUR,"Jl. Sedudo, SIDOREJO, SAWAHAN, KAB. NGANJUK, JAWA TIMUR"
QB7Z7UHK,Penentuan KA SPPG,Belum Beroperasi,KOTA JAYAPURA,PAPUA,"Jalan Pantai Hamadi, Desa/Kelurahan Tobati, Kecamatan Jayapura Selatan, TOBATI, JAYAPURA SELATAN, KOTA JAYAPURA, PAPUA"
NIDVG0LT,Penentuan KA SPPG,Belum Beroperasi,KAB. MAJENE,SULAWESI BARAT,"Baurung Kecamatan Banggae Timur Kabupaten Majene, BAURUNG, BANGGAE TIMUR, KAB. MAJENE, SULAWESI BARAT"
OEGWG45L,Penentuan KA SPPG,Belum Beroperasi,KAB. CIANJUR,JAWA BARAT,"Kp. Hegarmanah RT 006 / RW 003 Karangtengah, Cianjur, HEGARMANAH, KARANGTENGAH, KAB. CIANJUR, JAWA BARAT"
K2MZUDJI,Penentuan KA SPPG,Belum Beroperasi,KAB. GARUT,JAWA BARAT,"QR45+82J Cintadamai, Kabupaten Garut, Jawa Barat, CINTADAMAI, SUKARESMI, KAB. GARUT, JAWA BARAT"
HCUDGXIS,Penentuan KA SPPG,Belum Beroperasi,KAB. KLATEN,JAWA TENGAH,"UD Ani jati, Jl. Pedan-Cawas No.5, Dusun I, Gombang, Kec. Cawas, Kabupaten Klaten, Jawa Tengah 57463, GOMBANG, CAWAS, KAB. KLATEN, JAWA TENGAH"
QFCBCQR3,Penentuan KA SPPG,Belum Beroperasi,KOTA PALEMBANG,SUMATERA SELATAN,"Jalan Inspektur Marzuki, Kelurahan Siring Agung, Kecamatan Ilir Barat I Kota Palembang, Sumatera Selatan, SIRING AGUNG, ILIR BARAT I, KOTA PALEMBANG, SUMATERA SELATAN"
DPQKZMHA,Penentuan KA SPPG,Belum Beroperasi,KOTA BANDUNG,JAWA BARAT,"Komplek Vijaya Kusuma Jalan Kusuka Utama I Blok B3 No. 7A Cipadung - Cibiru, Kota Bandung, CIPADUNG, CIBIRU, KOTA BANDUNG, JAWA BARAT"
NWVN0UDX,Penentuan KA SPPG,Belum Beroperasi,KAB. TANGERANG,BANTEN,"JL. RAYA PEUSAR KP.CIKUPA RT003/RW001 KEL.CIKUPA KEC.CIKUPA  KAB. TANGERANG, BANTEN 15710 , SUKAMULYA, CIKUPA, KAB. TANGERANG, BANTEN"
78OSFN1U,Penentuan KA SPPG,Belum Beroperasi,KAB. KEBUMEN,JAWA TENGAH,"Jl. Nasional III, Krajan, Kaliputih, Kec. Kutowinangun, Kab. Kebumen, Jawa Tengah, 54393, KALIPUTIH, KUTOWINANGUN, KAB. KEBUMEN, JAWA TENGAH"
MSMOAHRO,Penentuan KA SPPG,Belum Beroperasi,KAB. ROKAN HULU,RIAU,"Jl. Syekh Ismail Desa Rambah Tengah Utara Kecamatan Rambah Kabupaten Rokan Hulu Riau (Bekas The Garden Cafe), RAMBAH TENGAH UTARA, RAMBAH, KAB. ROKAN HULU, RIAU"
8POGVMSH,Penentuan KA SPPG,Belum Beroperasi,KAB. GOWA,SULAWESI SELATAN,"Jl. Tumanurung Raya, Kalegowa, Kec. Somba Opu, Kabupaten Gowa, Sulawesi Selatan 92114, SUNGGUMINASA, SOMBA OPU, KAB. GOWA, SULAWESI SELATAN"
WKLMTILE,Penentuan KA SPPG,Belum Beroperasi,KAB. GORONTALO,GORONTALO,"Kec. Limboto, Kabupaten Gorontalo, Gorontalo, BONGOHULAWA, LIMBOTO, KAB. GORONTALO, GORONTALO"
JKSZ28GI,Penentuan KA SPPG,Belum Beroperasi,KAB. NIAS BARAT,SUMATERA UTARA,"Desa Sisarahili I, SISARAHILI I, MANDREHE, KAB. NIAS BARAT, SUMATERA UTARA"
QBXEYSH1,Penentuan KA SPPG,Belum Beroperasi,KOTA KENDARI,SULAWESI TENGGARA,"Jl Dewi Sartika Kel.Abeli, Kec Abeli RT 02 RW 04, Kendari, Sulawesi Tenggara, ABELI, ABELI, KOTA KENDARI, SULAWESI TENGGARA"
XFKXKEYU,Penentuan KA SPPG,Belum Beroperasi,KOTA BANDAR LAMPUNG,LAMPUNG,"JALAN HAJI ISMAIL BALAW DESA SUKADAMAI RT 012 LK 1, KEDAMAIAN, KEDAMAIAN, KOTA BANDAR LAMPUNG, LAMPUNG"
TX8XNO4I,Penentuan KA SPPG,Belum Beroperasi,KOTA BEKASI,JAWA BARAT,"Kp. Rawa Bebek Jl. Harapan Baru Regency Blok C19 RT03/012 Kota Baru, Bekasi Barat, Bekasi 17139 (Saputry Catering), KOTABARU, BEKASI BARAT, KOTA BEKASI, JAWA BARAT"
ZZCIRAC5,Penentuan KA SPPG,Belum Beroperasi,KAB. ACEH UTARA,ACEH,"jalan irigasi krueng pase, BEURINGEN, MEURAH MULIA, KAB. ACEH UTARA, ACEH"
L2B4DIOE,Penentuan KA SPPG,Belum Beroperasi,KAB. WAY KANAN,LAMPUNG,"kampung gisting jaya kec.negara batin kab.way kanan lampung, GISTING JAYA, NEGARA BATIN, KAB. WAY KANAN, LAMPUNG"
FXCCEUBM,Penentuan KA SPPG,Belum Beroperasi,KAB. BANDUNG,JAWA BARAT,"Jl. Galumpit No.99, Cileunyi Kulon, Kec. Cileunyi, Kabupaten Bandung, Jawa Barat 40621, CILEUNYI KULON, CILEUNYI, KAB. BANDUNG, JAWA BARAT"
C0KAJW2J,Penentuan KA SPPG,Belum Beroperasi,KAB. TEMANGGUNG,JAWA TENGAH,"Secakran RT 4 RW 1 Bantir Candiroto, Kentengsari, Kabupaten Temanggung, Jawa Tengah, BANTIR, CANDIROTO, KAB. TEMANGGUNG, JAWA TENGAH"
5XFRR2JC,Penentuan KA SPPG,Belum Beroperasi,KAB. TEMANGGUNG,JAWA TENGAH,"Jl. Parakan Weleri No.2, Bajangan, Mandisari, Kec. Parakan, Kabupaten Temanggung, Jawa Tengah 56254, MANDISARI, PARAKAN, KAB. TEMANGGUNG, JAWA TENGAH"
HCUWRCBM,Penentuan KA SPPG,Belum Beroperasi,KAB. KUDUS,JAWA TENGAH,"Jl. Lkr. Utara Kudus, Area Sawah, Klumpit, Kec. Gebog, Kabupaten Kudus, Jawa Tengah, KLUMPIT, GEBOG, KAB. KUDUS, JAWA TENGAH"
BJ8WP7KU,Penentuan KA SPPG,Belum Beroperasi,KOTA MAKASSAR,SULAWESI SELATAN,"Jl Tinumbu Lr. 166 No 149 Kel Pannampu Kec. Tallo Kota Makassar, PANNAMPU, TALLO, KOTA MAKASSAR, SULAWESI SELATAN"
84JPFWDA,Penentuan KA SPPG,Belum Beroperasi,KAB. MAJALENGKA,JAWA BARAT,"Blok Mulyasari, BANJARANSARI, CIKIJING, KAB. MAJALENGKA, JAWA BARAT"
TX8458Y5,Penentuan KA SPPG,Belum Beroperasi,KOTA TANGERANG,BANTEN,"Jl. Kh. Moh. Kup No.3 , PINANG, PINANG, KOTA TANGERANG, BANTEN"
VPOJCOEC,Penentuan KA SPPG,Belum Beroperasi,KOTA TASIKMALAYA,JAWA BARAT,"Jln Raya Mangin RT 04 / RW 05 kel. cipari, kec.Mangkubumi, kota tasikmalaya, jawabarat, kode pos 46181, CIPARI, MANGKUBUMI, KOTA TASIKMALAYA, JAWA BARAT"
AZJPRRYR,Penentuan KA SPPG,Belum Beroperasi,KOTA METRO,LAMPUNG,"Jl. Kerang RT 013 RW 006, YOSODADI, METRO TIMUR, KOTA METRO, LAMPUNG"
GTUAL53O,Penentuan KA SPPG,Belum Beroperasi,KAB. TEMANGGUNG,JAWA TENGAH,"Jl. Bulu - Parakan No.KM.05, Sawah, Danupayan, Kec. Bulu, Kabupaten Temanggung, Jawa Tengah 56253, DANUPAYAN, BULU, KAB. TEMANGGUNG, JAWA TENGAH"
XWN7MZVD,Penentuan KA SPPG,Belum Beroperasi,KAB. JEMBER,JAWA TIMUR,"Jln. KH. A.Syukri No.02 Pos 68194  Sumberwringin Sukowono,Jember, SUMBERWRINGIN, SUKOWONO, KAB. JEMBER, JAWA TIMUR"
KP3B87WW,Penentuan KA SPPG,Belum Beroperasi,KAB. TEMANGGUNG,JAWA TENGAH,"Kandangan Rowo Seneng No.35-27, Punduhan, Kandangan, Kec. Kandangan, Kabupaten Temanggung, Jawa Tengah, KANDANGAN, KANDANGAN, KAB. TEMANGGUNG, JAWA TENGAH"
HXYTW7TC,Penentuan KA SPPG,Belum Beroperasi,KAB. CIAMIS,JAWA BARAT,"Jl. Raya Ciamis-Cirebon Dusun Kalapa RT.002 RW.001, MEKARBUANA, PANAWANGAN, KAB. CIAMIS, JAWA BARAT"
ZATATCJR,Penentuan KA SPPG,Belum Beroperasi,KAB. LAMONGAN,JAWA TIMUR,"V5Q8+4CP Jl.Surya Kencana Ds.Karangkembang, Kec.Babat Kab.Lamongan Jawa Timur, KARANGKEMBANG, BABAT, KAB. LAMONGAN, JAWA TIMUR"
7ABOG73G,Penentuan KA SPPG,Belum Beroperasi,KAB. LOMBOK UTARA,NUSA TENGGARA BARAT,"Dusun Karang Petak RT. 003, Desa Pemenang Timur, Kecamatan Pemenang, Kabupaten Lombok Utara, PEMENANG TIMUR, PEMENANG, KAB. LOMBOK UTARA, NUSA TENGGARA BARAT"
SFBDPPOX,Penentuan KA SPPG,Belum Beroperasi,KAB. SERAM BAGIAN BARAT,MALUKU,"Jl. Syaikh Khidhir, Waesala, Kec. Huamual Belakang, Kabupaten Seram Bagian Barat, Maluku, WAESALA, HUAMUAL BELAKANG, KAB. SERAM BAGIAN BARAT, MALUKU"
QOOZDQXJ,Penentuan KA SPPG,Belum Beroperasi,KAB. TULANG BAWANG,LAMPUNG,"kampung boga tama, BOGA TAMA, PENAWAR TAMA, KAB. TULANG BAWANG, LAMPUNG"
YEWXHVW7,Penentuan KA SPPG,Belum Beroperasi,KAB. TEMANGGUNG,JAWA TENGAH,"Jl. Campursalam, Dusun Grogol, Desa Kutoanyar, Kecamatan Kedu, Kabupaten Temanggung, Jawa Tengah 56252, KUTOANYAR, KEDU, KAB. TEMANGGUNG, JAWA TENGAH"
D3WCFIU8,Penentuan KA SPPG,Belum Beroperasi,KOTA JAYAPURA,PAPUA,"Jalan Raya Argapura, Hotel Agung, Rt 003 / Rw 002, Kelurahan Hamadi, Kecamatan Jayapura Selatan, Kota Jayapura, HAMADI, JAYAPURA SELATAN, KOTA JAYAPURA, PAPUA"
VLZ4H6RJ,Penentuan KA SPPG,Belum Beroperasi,KOTA ADM. JAKARTA TIMUR,DKI JAKARTA,"Jl. Swadaya Raya No.48-49, RT.9/RW.5, Duren Sawit, Kec. Duren Sawit, Kota Jakarta Timur, Daerah Khusus Ibukota Jakarta 13440, DUREN SAWIT, DUREN SAWIT, KOTA ADM. JAKARTA TIMUR, DKI JAKARTA"
ONSVMTOA,Penentuan KA SPPG,Belum Beroperasi,KAB. PIDIE,ACEH,"Jl. Banda Aceh - Medan Desa Blang Lileu Kec. Mutiara Kab. Pidie Prov. Aceh , BLANG LILUE, MUTIARA, KAB. PIDIE, ACEH"
48DO2OAQ,Penentuan KA SPPG,Belum Beroperasi,KOTA TUAL,MALUKU,"Jl. Baldu Wahadat - Mangon, TUAL, PULAU DULLAH SELATAN, KOTA TUAL, MALUKU"
FINTCMWS,Penentuan KA SPPG,Belum Beroperasi,KOTA TIDORE KEPULAUAN,MALUKU UTARA,"SPN Polda Maluku Utara Jl. Belakang, Gurabati, Kecamatan Tidore Selatan Kota Tidore Kepulauan Maluku Utara, GURABATI, TIDORE SELATAN, KOTA TIDORE KEPULAUAN, MALUKU UTARA"
KQFD5PH9,Penentuan KA SPPG,Belum Beroperasi,KAB. CILACAP,JAWA TENGAH,"Jl. Jend. Gatot Subroto No. 147 RT022 RW 033, KROYA, KROYA, KAB. CILACAP, JAWA TENGAH"
FUNQH7GN,Penentuan KA SPPG,Belum Beroperasi,KAB. CIAMIS,JAWA BARAT,"Jl. Panawangan-Kawunglarang No.62 RT.001 RW.001 Dsn. Kaom , NAGARAPAGEUH, PANAWANGAN, KAB. CIAMIS, JAWA BARAT"
S6AWALCX,Penentuan KA SPPG,Belum Beroperasi,KAB. CIREBON,JAWA BARAT,"PERUMAHAN WIRATAMA JALAN DAHLIA NOMOR 18 DESA KEDUNGJAYA
, KEDUNGJAYA, KEDAWUNG, KAB. CIREBON, JAWA BARAT"
18NC0B86,Penentuan KA SPPG,Belum Beroperasi,KAB. LAMPUNG SELATAN,LAMPUNG,"Jl.  Marga Dantaran, Desa Banjarmasin Dusun Repong Berak, RT/RW.011/003
, BANJAR MASIN, PENENGAHAN, KAB. LAMPUNG SELATAN, LAMPUNG"
