ID_SPPG,Status_Pengajuan,Status_Operasional,Kota_Kabupaten,Provinsi,Alamat
2DHXCPPR,Penentuan KA SPPG,Belum Beroperasi,KOTA PONTIANAK,KALIMANTAN BARAT,"Jl. Khatulistiwa No.4, Siantan Hilir, Kec. Pontianak Utara, Kota Pontianak, Kalimantan Barat 78243, SIANTAN HILIR, PONTIANAK UTARA, KOTA PONTIANAK, KALIMANTAN BARAT"
TVY513FQ,Penentuan KA SPPG,Belum Beroperasi,KAB. MOJOKERTO,JAWA TIMUR,"DUSUN KAUMAN RT 05 RW 01 DESA BANGSAL KEC. BANGSAL KAB. MOJOKERTO, BANGSAL, BANGSAL, KAB. MOJOKERTO, JAWA TIMUR"
Q7LKR7X8,Penentuan KA SPPG,Belum Beroperasi,KAB. SAMPANG,JAWA TIMUR,"Jalan KH. Abubakar, Desa/Kelurahan Torjun, Kec. Torjun, Kab. Sampang,
Provinsi Jawa Timur, TORJUN, TORJUN, KAB. SAMPANG, JAWA TIMUR"
6SHGTEIQ,Penentuan KA SPPG,Belum Beroperasi,KOTA TASIKMALAYA,JAWA BARAT,"jl saptamarga kel cikalang, CIKALANG, TAWANG, KOTA TASIKMALAYA, JAWA BARAT"
N2MYSZSK,Penentuan KA SPPG,Belum Beroperasi,KAB. TULANG BAWANG BARAT,LAMPUNG,"Tirta Kencana Kec.Tulang Bawang Tengah, TIRTA KENCANA, TULANG BAWANG TENGAH, KAB. TULANG BAWANG BARAT, LAMPUNG"
0KNU9MY5,Penentuan KA SPPG,Belum Beroperasi,KAB. PESAWARAN,LAMPUNG,"Jl. Raya Kurungan Nyawa, KURUNGAN NYAWA, GEDONG TATAAN, KAB. PESAWARAN, LAMPUNG"
8ETSBN2L,Penentuan KA SPPG,Belum Beroperasi,KAB. HULU SUNGAI SELATAN,KALIMANTAN SELATAN,"Sarang Halang RT.02 RW.01 Kec. Sungai Raya Kab. Hulu Sungai Selatan Provinsi Kalimantan Selatan, SARANG HALANG, SUNGAI RAYA, KAB. HULU SUNGAI SELATAN, KALIMANTAN SELATAN"
SX2N2ZFX,Penentuan KA SPPG,Belum Beroperasi,KOTA BOGOR,JAWA BARAT,"Jl. Fajar Indah No.1, Semplak, Kec. Bogor Bar., Kota Bogor, Jawa Barat 16114, SEMPLAK, BOGOR BARAT, KOTA BOGOR, JAWA BARAT"
POL4FCDN,Penentuan KA SPPG,Belum Beroperasi,KAB. OGAN KOMERING ULU,SUMATERA SELATAN,"JLN. H MUHAMMAD MUSLIMIN BATURAJA KELURAHAN TANJUNG BARU KECAMATAN BATURAJA TIMUR KABUPAREN OGAN KOMERING ULU PROVINSI SUMATERA SELATAN, TANJUNG BARU, BATURAJA TIMUR, KAB. OGAN KOMERING ULU, SUMATERA SELATAN"
A6MUQJSF,Penentuan KA SPPG,Belum Beroperasi,KAB. LAMPUNG SELATAN,LAMPUNG,"Desa Bumi jaya, Rt 04 Rw 02, Kecamatan candi puro, Kabupaten lampung selatan, BUMI JAYA, CANDIPURO, KAB. LAMPUNG SELATAN, LAMPUNG"
UZIK42L0,Penentuan KA SPPG,Belum Beroperasi,KAB. TAPANULI SELATAN,SUMATERA UTARA,"Jl.lintas Sumatera Pal XI - Sipirok KM -10 Desa Kilang Papan Kec.Sipirok Kab.Tapsel Provinsi Sumatera Utara, KILANG PAPAN, SIPIROK, KAB. TAPANULI SELATAN, SUMATERA UTARA"
ZRXPJ4WC,Penentuan KA SPPG,Belum Beroperasi,KOTA SUKABUMI,JAWA BARAT,"Jl pelabuhan 2 no.134, Rt 01 Rw 05, kel warudoyong kec warudoyong kota sukabumi, WARUDOYONG, WARUDOYONG, KOTA SUKABUMI, JAWA BARAT"
ILR9SLV3,Penentuan KA SPPG,Belum Beroperasi,KAB. TAKALAR,SULAWESI SELATAN,"lingkungan Tamalate Kelurahan Mangadu Kecamatan Mangarabombang Kabupaten Takalar Sul-Sel, MANGADU, MANGARABOMBANG, KAB. TAKALAR, SULAWESI SELATAN"
DUP8CMWZ,Penentuan KA SPPG,Belum Beroperasi,KAB. MESUJI,LAMPUNG,"Jl. Petamburan Desa Mukti jaya Rt 003 Rw 003, MUKTI JAYA, TANJUNG RAYA, KAB. MESUJI, LAMPUNG"
CTQSRWSC,Penentuan KA SPPG,Belum Beroperasi,KAB. WAJO,SULAWESI SELATAN,"Jl. Poros Cabenge - Sengkang, Caleko Desa Wage Kecamatan Sabangparu Kabupaten Wajo, WAGE, SABANGPARU, KAB. WAJO, SULAWESI SELATAN"
JZFTQG5Z,Penentuan KA SPPG,Belum Beroperasi,KAB. BLORA,JAWA TENGAH,"RT 05 RW 02 Desa Tobo , Kecamatan, Jati Kabupaten Blora, TOBO, JATI, KAB. BLORA, JAWA TENGAH"
ZBQLWS1A,Penentuan KA SPPG,Belum Beroperasi,KAB. BEKASI,JAWA BARAT,"Jalan Raya Cibening - Cikedokan, Cikedokan, Kec. Cikarang Barat, Kabupaten Bekasi, Jawa Barat 17530 , CIKEDOKAN, CIKARANG BARAT, KAB. BEKASI, JAWA BARAT"
WQCUKGAL,Penentuan KA SPPG,Belum Beroperasi,KAB. SAMPANG,JAWA TIMUR,"Dusun Rakmerakan Desa Tlambah Kecamatan Karangpenang Kabupaten Sampang, TLAMBAH, KARANGPENANG, KAB. SAMPANG, JAWA TIMUR"
DIOW1NJ5,Penentuan KA SPPG,Belum Beroperasi,KOTA MAKASSAR,SULAWESI SELATAN,"NIPA-NIPA, ANTANG, MANGGALA, KOTA MAKASSAR, SULAWESI SELATAN"
JCCGAWMB,Penentuan KA SPPG,Belum Beroperasi,KOTA PAGAR ALAM,SUMATERA SELATAN,"Jalan Air Perikan, NENDAGUNG , PAGAR ALAM SELATAN, KOTA PAGAR ALAM, SUMATERA SELATAN"
C4L2G05D,Penentuan KA SPPG,Belum Beroperasi,KAB. TORAJA UTARA,SULAWESI SELATAN,"NRS Team, Pasele, Kec. Rantepao, Kab. Toraja Utara
, PASALE, RANTEPAO, KAB. TORAJA UTARA, SULAWESI SELATAN"
HKVASVOG,Penentuan KA SPPG,Belum Beroperasi,KAB. LOMBOK TIMUR,NUSA TENGGARA BARAT,"Lekong, LEPAK TIMUR, SAKRA TIMUR, KAB. LOMBOK TIMUR, NUSA TENGGARA BARAT"
EWGQFZOC,Penentuan KA SPPG,Belum Beroperasi,KAB. MALANG,JAWA TIMUR,"Jalan Yonkav, Pergudangan Sentral Singosari Blok D-17, RANDUAGUNG, SINGOSARI, KAB. MALANG, JAWA TIMUR"
MDIB5G5B,Penentuan KA SPPG,Belum Beroperasi,KAB. SIDOARJO,JAWA TIMUR,"Jalan sruni 151 kec gedangan. Kab sidoarjo. Kel sruni. Jawa timur 61254, SRUNI, GEDANGAN, KAB. SIDOARJO, JAWA TIMUR"
T5FJ7JSA,Penentuan KA SPPG,Belum Beroperasi,KOTA PEKALONGAN,JAWA TENGAH,"Jalan Limas Raya nomer 2, RT 3 Rw 18, kel Krapyak, Kec Pekalongan Utara. Kota Pekalongan, KRAPYAK, PEKALONGAN UTARA, KOTA PEKALONGAN, JAWA TENGAH"
CTY1TNVN,Penentuan KA SPPG,Belum Beroperasi,KAB. OGAN ILIR,SUMATERA SELATAN,"Jln.Lintas Timur Ds.III meranjat 3 No.227 Kecamatan Indralaya Selatan – Ogan Ilir Sumatera Selatan, MERANJAT III, INDRALAYA SELATAN, KAB. OGAN ILIR, SUMATERA SELATAN"
HKWJBPUO,Penentuan KA SPPG,Belum Beroperasi,KAB. LOMBOK TIMUR,NUSA TENGGARA BARAT,"Jalan jurusan keruak selong, RENSING RAYA, SAKRA BARAT, KAB. LOMBOK TIMUR, NUSA TENGGARA BARAT"
XPJTURAN,Penentuan KA SPPG,Belum Beroperasi,KAB. PAMEKASAN,JAWA TIMUR,"Dusun Bungur Desa Potoan Dajah Kecamatan Palengaan Kabupaten Pamekasan - Jawa Timur, PATOAN DAJAH, PALENGGAAN, KAB. PAMEKASAN, JAWA TIMUR"
CBWTBDI8,Penentuan KA SPPG,Belum Beroperasi,KAB. KUBU RAYA,KALIMANTAN BARAT,"Jl. Baburazak Barat Rt 004/ Rw 012, Desa Padang Tikar Satu, Kec. Batu Ampar, Kab. Kubu Raya, Kalimantan Barat, PADANG TIKAR SATU, BATU AMPAR, KAB. KUBU RAYA, KALIMANTAN BARAT"
FLF6DMTY,Penentuan KA SPPG,Belum Beroperasi,KAB. BANDUNG,JAWA BARAT,"GOR Shefira
Komplek Cibiru Raya Regency, kampung Cibangkonol, Desa Cibiru wetan, kec Cileunyi, Kab Bandung, CIBIRU WETAN, CILEUNYI, KAB. BANDUNG, JAWA BARAT"
KPAOZLM7,Penentuan KA SPPG,Belum Beroperasi,KAB. TEGAL,JAWA TENGAH,"Wringinjenggot RT 002/RW 004, WRINGINJENGGOT, BALAPULANG, KAB. TEGAL, JAWA TENGAH"
310LSXTI,Penentuan KA SPPG,Belum Beroperasi,KAB. MAGELANG,JAWA TENGAH,"Kramat, Congkrang, Kec. Muntilan, Kabupaten Magelang, Jawa Tengah 56415, CONGKRANG, MUNTILAN, KAB. MAGELANG, JAWA TENGAH"
O3CVNWVR,Penentuan KA SPPG,Belum Beroperasi,KAB. SERANG,BANTEN,"Jl. Syeh Nawawi Al-BantanI , SINDANGSARI, PABUARAN, KAB. SERANG, BANTEN"
KRZ6XWHU,Penentuan KA SPPG,Belum Beroperasi,KAB. WONOGIRI,JAWA TENGAH,"5WJM+XX5, Jl. Pudak V, Pokoh, Wonoboyo, Kec. Wonogiri, Kabupaten Wonogiri, Jawa Tengah 57615, WONOBOYO, WONOGIRI, KAB. WONOGIRI, JAWA TENGAH"
ATHU4LCK,Penentuan KA SPPG,Belum Beroperasi,KAB. TEMANGGUNG,JAWA TENGAH,"Dusun Wonorejo Rt 3 Rw 5 Desa Kebonsari, Kec. Wonoboyo, Kab. Temanggung, Jawa Tengah, KEBONSARI, WONOBOYO, KAB. TEMANGGUNG, JAWA TENGAH"
WWOPBYEK,Penentuan KA SPPG,Belum Beroperasi,KAB. KEDIRI,JAWA TIMUR,"Jalan Ahmad Yani, Desa Gabru, Kecamatan Gurah, Kabupaten Kediri, GABRU, GURAH, KAB. KEDIRI, JAWA TIMUR"
2BOF52QS,Penentuan KA SPPG,Belum Beroperasi,KAB. OGAN ILIR,SUMATERA SELATAN,"DUSUN II DESA RAMA KASIH KECAMATAN MUARA KUANG KABUPATEN OGAN ILIR PROVINSI SUMATERA SELATAN, RAMAKASIH, MUARA KUANG, KAB. OGAN ILIR, SUMATERA SELATAN"
WRENAJKQ,Penentuan KA SPPG,Belum Beroperasi,KAB. SUMEDANG,JAWA BARAT,"JALAN KEBONKOL NO 79 KELURAHAN REGOL WETAN KECAMATAN SUMEDANG SELATAN, REGOL WETAN , SUMEDANG SELATAN, KAB. SUMEDANG, JAWA BARAT"
KC1DACH4,Penentuan KA SPPG,Belum Beroperasi,KAB. PATI,JAWA TENGAH,"Mojolawaran Kec Gabus Kab Paiti, MOJOLAWARAN, GABUS, KAB. PATI, JAWA TENGAH"
UDJNMXR7,Penentuan KA SPPG,Belum Beroperasi,KAB. POLEWALI MANDAR,SULAWESI BARAT,"JL TODILALING SAMPING CAFE N&R, PEKKABATA, POLEWALI, KAB. POLEWALI MANDAR, SULAWESI BARAT"
L2SSRKDZ,Penentuan KA SPPG,Belum Beroperasi,KAB. SUKOHARJO,JAWA TENGAH,"Jl. Raya Dalangan - Tawangsari, Karangasem, Kateguhan, Tawangsari, Sukoharjo, DALANGAN, TAWANGSARI, KAB. SUKOHARJO, JAWA TENGAH"
SKWQIKOZ,Penentuan KA SPPG,Belum Beroperasi,KAB. TRENGGALEK,JAWA TIMUR,"RT 14 RW 03 Dusun Blimbing Kec.Dongko  Kabupaten Trenggalek, DONGKO, DONGKO, KAB. TRENGGALEK, JAWA TIMUR"
ALLAOXUA,Penentuan KA SPPG,Belum Beroperasi,KOTA DEPOK,JAWA BARAT,"Jl. H Hamid I, SAWANGAN BARU, SAWANGAN, KOTA DEPOK, JAWA BARAT"
ST9JO7NT,Penentuan KA SPPG,Belum Beroperasi,KAB. PANDEGLANG,BANTEN,"Jl. Jenderal Ahmad Yani, Kp Masjid rt 01 rt 06, Kel. Labuan, Kec. Labuan, Kab. Pandeglang, Banten 42264, LABUAN, LABUAN, KAB. PANDEGLANG, BANTEN"
PLYMTKV9,Penentuan KA SPPG,Belum Beroperasi,KOTA LUBUK LINGGAU,SUMATERA SELATAN,"jalan yos sudarso gang binjai rt 03 no 103 depan puskesmas citra medika kelurahan batu urip taba lubukinggau timur 1, BATU URIP TABA, LUBUK LINGGAU TIMUR I, KOTA LUBUK LINGGAU, SUMATERA SELATAN"
0K52ICDG,Penentuan KA SPPG,Belum Beroperasi,KAB. KUPANG,NUSA TENGGARA TIMUR,"Jl. Terusan Tablolong , Rt.009/Rw.004, Kel. Batakte, Kec.Kupang Barat, , BATAKTE, KUPANG BARAT, KAB. KUPANG, NUSA TENGGARA TIMUR"
9NZPGE8J,Penentuan KA SPPG,Belum Beroperasi,KOTA PRABUMULIH,SUMATERA SELATAN,"Jl. Prabumulih - Baturaja, Karangan, Rambang Kapak Tengah (Depan SPBU Karangan), KARANGAN, RAMBANG KAPAK TENGAH, KOTA PRABUMULIH, SUMATERA SELATAN"
IOQOAK82,Penentuan KA SPPG,Belum Beroperasi,KAB. OGAN ILIR,SUMATERA SELATAN,"Dusun II Sungai Lebung Ulu, S. LEBUNG ULU, PEMULUTAN SELATAN, KAB. OGAN ILIR, SUMATERA SELATAN"
VFVLJWV2,Penentuan KA SPPG,Belum Beroperasi,KAB. SUBANG,JAWA BARAT,"Jl. Raden Ajeng Kartini, PASIRKAREUMBI, SUBANG, KAB. SUBANG, JAWA BARAT"
ZSTPAUNE,Penentuan KA SPPG,Belum Beroperasi,KOTA JAMBI,JAMBI,"JL. AGUS SALIM HANDIL JAYA KEC. JELUTUNG, KOTA JAMBI, JAMBI 36125, HANDIL JAYA, JELUTUNG, KOTA JAMBI, JAMBI"
DQ6ZXSWK,Penentuan KA SPPG,Belum Beroperasi,KOTA BAU BAU,SULAWESI TENGGARA,"Murhum Bau Bau , BATULO, WOLIO, KOTA BAU BAU, SULAWESI TENGGARA"
A1QZZW9X,Penentuan KA SPPG,Belum Beroperasi,KAB. GARUT,JAWA BARAT,"Kp. Babakan Tani RT 002 RW 006 Desa Cimaragas Kecamatan Pangatikan, CIMARABAS, PANGATIKAN, KAB. GARUT, JAWA BARAT"
VJLPMXRH,Penentuan KA SPPG,Belum Beroperasi,KOTA MOJOKERTO,JAWA TIMUR,"JL BRAWIJAYA NO 1 DESA KAUMAN KECAMATAN PRAJURIT KULON KOTA MOJOKERTO, KAUMAN, PRAJURITKULON, KOTA MOJOKERTO, JAWA TIMUR"
6RIHTCFI,Penentuan KA SPPG,Belum Beroperasi,KOTA DEPOK,JAWA BARAT,"Desa Grogol Kecamatan Limo Kota Depok Jawa Barat , GROGOL, LIMO, KOTA DEPOK, JAWA BARAT"
ZV6AE3JK,Penentuan KA SPPG,Belum Beroperasi,KOTA PARE PARE,SULAWESI SELATAN,"Jl. Hikmah Kel Bumi Harapan, Kec. Bacukiki Barat, Kota Pare pare, Prov Sulawesi Selatan, BUMI HARAPAN, BACUKIKI BARAT, KOTA PARE PARE, SULAWESI SELATAN"
KBC7BGQO,Penentuan KA SPPG,Belum Beroperasi,KAB. KARIMUN,KEPULAUAN RIAU,"Jl. Ahmad Yani RT 004/RW 002, SUNGAI PASIR, MERAL, KAB. KARIMUN, KEPULAUAN RIAU"
TXRSF2PW,Penentuan KA SPPG,Belum Beroperasi,KAB. ACEH BESAR,ACEH,"Jl Banda Aceh - Medan Desa Lingom Kecamatan Indrapuri Aceh Besar , LINGOM, INDRAPURI, KAB. ACEH BESAR, ACEH"
CFJTKDTY,Penentuan KA SPPG,Belum Beroperasi,KAB. INDRAMAYU,JAWA BARAT,"Jl. Raya Tugu Kidul  Blok Kuang RT 015 RW 003, TUGUKIDUL, SLIYEG, KAB. INDRAMAYU, JAWA BARAT"
PO0XM85N,Penentuan KA SPPG,Belum Beroperasi,KAB. CIAMIS,JAWA BARAT,"RT 009 / RW 002 DUSUN SIDAMUKTI DESA CINTAJAYA KECAMATAN LAKBOK KABUPATEN CIAMIS JAWA BARAT, KODE POS 46385, CINTAJAYA, LAKBOK, KAB. CIAMIS, JAWA BARAT"
LQVXOM6X,Penentuan KA SPPG,Belum Beroperasi,KAB. KARIMUN,KEPULAUAN RIAU,"Jl. Raja Oesman, Sungai Pasir, SUNGAI PASIR, MERAL, KAB. KARIMUN, KEPULAUAN RIAU"
SHGRH1Z6,Penentuan KA SPPG,Belum Beroperasi,KAB. TRENGGALEK,JAWA TIMUR,"Kelurahan Ngantru, Kec. Trenggalek, Kab, Trenggalek, NGANTRU, TRENGGALEK, KAB. TRENGGALEK, JAWA TIMUR"
7HPSTYQO,Penentuan KA SPPG,Belum Beroperasi,KAB. PACITAN,JAWA TIMUR,"Jl. Pantrem No. 21, Dsn Krajan, Desa Tremas, Kec. Arjosari, Kab. Pacitan, TREMAS, ARJOSARI, KAB. PACITAN, JAWA TIMUR"
ZEPTYVZZ,Penentuan KA SPPG,Belum Beroperasi,KAB. TABANAN,BALI,"Jl. Raya Meliling Kerambitan , Banjar Dukuh Gede, Desa Baturiti, Kecamatan Kerambitan, Kabupaten Tabanan, Provinsi Bali, BATURITI, KERAMBITAN, KAB. TABANAN, BALI"
TJFWDBAE,Penentuan KA SPPG,Belum Beroperasi,KAB. LOMBOK TENGAH,NUSA TENGGARA BARAT,"8738+3JH Leneng, Kabupaten Lombok Tengah, Nusa Tenggara Bar., PRAYA, PRAYA, KAB. LOMBOK TENGAH, NUSA TENGGARA BARAT"
P4BZ7DAM,Penentuan KA SPPG,Belum Beroperasi,KOTA BALIKPAPAN,KALIMANTAN TIMUR,"Jl. Jenderal Sudirman No. 31, Gn.Bahagia, Kec. Balikpapan Selatan, Kota Balikpapan Kalimantan Timur761114 , GUNUNGBAHAGIA, BALIKPAPAN SELATAN, KOTA BALIKPAPAN, KALIMANTAN TIMUR"
A9ITZ1SS,Penentuan KA SPPG,Belum Beroperasi,KAB. LOMBOK TENGAH,NUSA TENGGARA BARAT,"Jln Arya Banjar Getas, Praya, Desa Praya Kec. Praya Lombok Tengah NTB , PRAYA, PRAYA, KAB. LOMBOK TENGAH, NUSA TENGGARA BARAT"
LIMYGFJO,Penentuan KA SPPG,Belum Beroperasi,KAB. OGAN KOMERING ILIR,SUMATERA SELATAN,"JLN LINTAS TIMUR DUSUN VII DESA PEMATANG PANGGANG KECAMATAN MESUJI KABUPATEN OGAN KOMERING ILIR PROVINSI SUMATERA SELATAN, PEMATANG PANGGANG, MESUJI, KAB. OGAN KOMERING ILIR, SUMATERA SELATAN"
RYDEW2KD,Penentuan KA SPPG,Belum Beroperasi,KAB. PAMEKASAN,JAWA TIMUR,"Dusun Ragang, Desa Tlanakan, Kecamatan Tlanakan, Kabupaten Pamekasan, Jawa Timur, 69371, TLANAKAN, TLANAKAN, KAB. PAMEKASAN, JAWA TIMUR"
BLXBC4HW,Penentuan KA SPPG,Belum Beroperasi,KAB. REMBANG,JAWA TENGAH,"Ngreco rt.05 rw.02, LANGKIR, PANCUR, KAB. REMBANG, JAWA TENGAH"
TFEMIBDX,Penentuan KA SPPG,Belum Beroperasi,KAB. CIANJUR,JAWA BARAT,"Jl Agrabinta Desa Bojongkaso Rt 05 Rw 03 Kec. Agrabinta Kab. Cianjur, BOJONGKASO, AGRABINTA, KAB. CIANJUR, JAWA BARAT"
NV072AHM,Penentuan KA SPPG,Belum Beroperasi,KAB. KARAWANG,JAWA BARAT,"kp.rawacula dsn.kedungmulyya rt27 rw 08 ds.pasirkaliki kec.rawamerta
Kabupaten Karawang, PASIRKALIKI, RAWAMERTA, KAB. KARAWANG, JAWA BARAT"
LITLS86E,Penentuan KA SPPG,Belum Beroperasi,KAB. TULANG BAWANG BARAT,LAMPUNG,"Jln. Jendral Sudirman Murni Jaya 001/003,
Tiyuh Murni Jaya, Kecamatan Tumijajar,
Kabupaten Tulang Bawang Barat, Lampung, MURNI JAYA, TUMIJAJAR, KAB. TULANG BAWANG BARAT, LAMPUNG"
JWJD8MNK,Penentuan KA SPPG,Belum Beroperasi,KAB. LIMA PULUH KOTA,SUMATERA BARAT,"Jl. Padang lawas MUNGKA no 5 kenagarian sungai antuan kecamatan Mungka Kab. Lima Puluh kota, Provinsi Sumatera Barat, SUNGAI ANTUAN, MUNGKA, KAB. LIMA PULUH KOTA, SUMATERA BARAT"
WSPFV8EK,Penentuan KA SPPG,Belum Beroperasi,KAB. PIDIE,ACEH,"Jl. Jabal Ghafur - Sigli Gampong Blang Garot Kecamatan Garot Kabupaten Pidie, BLANG GAROT, INDRAJAYA, KAB. PIDIE, ACEH"
BQVRESNX,Penentuan KA SPPG,Belum Beroperasi,KAB. BOYOLALI,JAWA TENGAH,"Jl. Proklamasi No 20 Bandung Lor, Kelurahan Beji, Kecamatan Andong. Kabupaten Boyolali, Jawa Tengah, BEJI, ANDONG, KAB. BOYOLALI, JAWA TENGAH"
VA09ZTAA,Penentuan KA SPPG,Belum Beroperasi,KAB. HULU SUNGAI UTARA,KALIMANTAN SELATAN,"Jl.Lambung Mangkurat Rt.05 No.14, KOTA RAJA, AMUNTAI SELATAN, KAB. HULU SUNGAI UTARA, KALIMANTAN SELATAN"
OV0ZACSM,Penentuan KA SPPG,Belum Beroperasi,KOTA BANDUNG,JAWA BARAT,"Jl. Pasirsalam Asri No. D6 RT/RW 007/005 Kel. Ancol Kec. Regol Kota Bandung, ANCOL, REGOL, KOTA BANDUNG, JAWA BARAT"
EIQVIWHG,Penentuan KA SPPG,Belum Beroperasi,KAB. LAMPUNG TIMUR,LAMPUNG,"Pekalongan, Pekalongan, Lampung Timur, Lampung, PEKALONGAN, PEKALONGAN, KAB. LAMPUNG TIMUR, LAMPUNG"
XRIQCE24,Penentuan KA SPPG,Belum Beroperasi,KAB. KUNINGAN,JAWA BARAT,"Dusun Manis Rt 012 Rw 004, CIPASUNG, DARMA, KAB. KUNINGAN, JAWA BARAT"
XCQKWTXV,Penentuan KA SPPG,Belum Beroperasi,KOTA BANDUNG,JAWA BARAT,"Jalan Abadi III No. 6 Keluarahan Isola Sukasari Kota Bandung, ISOLA, SUKASARI, KOTA BANDUNG, JAWA BARAT"
9IR1LYFH,Penentuan KA SPPG,Belum Beroperasi,KAB. CIAMIS,JAWA BARAT,"Jl. Nasional III No.84, Ciamis, Kec. Ciamis, Kabupaten Ciamis, Jawa Barat 46211, CIAMIS, CIAMIS, KAB. CIAMIS, JAWA BARAT"
NFSPZNGJ,Penentuan KA SPPG,Belum Beroperasi,KAB. SINJAI,SULAWESI SELATAN,"Desa Kalobba, Kecamatan Tellulimpoe, Kabupaten Sinjai - Sulawesi Selatan, KALOBBA, TELLU LIMPOE, KAB. SINJAI, SULAWESI SELATAN"
G6KKQVC0,Penentuan KA SPPG,Belum Beroperasi,KAB. CIREBON,JAWA BARAT,"jl Apel No 02, KEBAREPAN, PLUMBON, KAB. CIREBON, JAWA BARAT"
YIGE2HHW,Penentuan KA SPPG,Belum Beroperasi,KOTA PALU,SULAWESI TENGAH,"Jl. Pengga lembah, no.19, PANTOLOAN, TAWAELI, KOTA PALU, SULAWESI TENGAH"
H4IU8UVW,Penentuan KA SPPG,Belum Beroperasi,KAB. SINJAI,SULAWESI SELATAN,"Jln. Persatuan Raya (poros sinjai-kajang) Dusun Passahakue, desa pasimarannu kec Sinjai Timur, Kab. Sinjai
, PASIMARANNU, SINJAI TIMUR, KAB. SINJAI, SULAWESI SELATAN"
IL16GGWN,Penentuan KA SPPG,Belum Beroperasi,KAB. BANDUNG,JAWA BARAT,"Jln. Kp Jalupang rt 01 rw 12 Ds. Banda Sari Kec. Cangkuang kab Bandung, BANDASARI, CANGKUANG, KAB. BANDUNG, JAWA BARAT"
QOMK2HNT,Penentuan KA SPPG,Belum Beroperasi,KAB. CIANJUR,JAWA BARAT,"Sindangsari Kp. Cilomang RT 03 RW 01 Kecamatan Cilaku Kabupaten Cianjur Jawa Barat, SINDANGSARI, CILAKU, KAB. CIANJUR, JAWA BARAT"
ZDPENOHS,Penentuan KA SPPG,Belum Beroperasi,KAB. KENDAL,JAWA TENGAH,"TRATMULYO RT 03 RW 02 KEC.WELERI KAB.KENDAL JAWA TENGAH, TRATEMULYO, WELERI, KAB. KENDAL, JAWA TENGAH"
IPNQ2RTS,Penentuan KA SPPG,Belum Beroperasi,KAB. PACITAN,JAWA TIMUR,"Jl. Dirgantara, Barean, sidoharjo, Kec. Pacitan, Kabupaten Pacitan, Jawa Timur, SIDOHARJO, PACITAN, KAB. PACITAN, JAWA TIMUR"
MYDKHLYS,Penentuan KA SPPG,Belum Beroperasi,KAB. LAMPUNG SELATAN,LAMPUNG,"kelurahan negara ratu, kecamatan natar, Kab. Lampung selatan, prov. lampung, NEGARA RATU, NATAR, KAB. LAMPUNG SELATAN, LAMPUNG"
XAQI1ERW,Penentuan KA SPPG,Belum Beroperasi,KAB. BANYUWANGI,JAWA TIMUR,"Jl. Raya Lijen, Sukosari, Paspan, Kec. Glagah, Kabupaten Banyuwangi, Jawa Timur 68432, GLAGAH, GLAGAH, KAB. BANYUWANGI, JAWA TIMUR"
7Y6N36W4,Penentuan KA SPPG,Belum Beroperasi,KAB. SUKABUMI,JAWA BARAT,"Kp.Cikadu RT 02/RW 09 Desa Sukalarang
Kecamatan Sukalarang
Kab.Sukabumi, SUKALARANG, SUKALARANG, KAB. SUKABUMI, JAWA BARAT"
I5Z1QEZY,Penentuan KA SPPG,Belum Beroperasi,KAB. TABANAN,BALI,"Jl.Dukuh Br TegalDesa Dauh Peken, Kec. Tabanan, Kab.Tabanan, Prov. Bali
, DAUH PEKEN, TABANAN, KAB. TABANAN, BALI"
BAWW4JDW,Penentuan KA SPPG,Belum Beroperasi,KAB. TABANAN,BALI,"Jl.Raya Antosari Pupuan, Br.Bangsing, Desa Batungsel Kec. Pupuan Kab. Tabanan, Prov. Bali, BATUNGSEL, PUPUAN, KAB. TABANAN, BALI"
ZQYKKTT5,Penentuan KA SPPG,Belum Beroperasi,KAB. LOMBOK TIMUR,NUSA TENGGARA BARAT,"Jl Raya Sukamulia - Rempung, REMPUNG, PRINGGASELA, KAB. LOMBOK TIMUR, NUSA TENGGARA BARAT"
A8NSADLE,Penentuan KA SPPG,Belum Beroperasi,KAB. LOMBOK TIMUR,NUSA TENGGARA BARAT,"Jln. Siwi raya, Desa Sukaraja Kec. Jeroweru Lombok Timur NTB , SUKARAJA, JEROWARU, KAB. LOMBOK TIMUR, NUSA TENGGARA BARAT"
HLDWLRZQ,Penentuan KA SPPG,Belum Beroperasi,KAB. TASIKMALAYA,JAWA BARAT,"KP SUKSRESMI RT 02 RW 05, PAKEMITANKIDUL, CIAWI, KAB. TASIKMALAYA, JAWA BARAT"
JCAPTHGR,Penentuan KA SPPG,Belum Beroperasi,KAB. PIDIE JAYA,ACEH,"JALAN RAYA MEDAN BANDA ACEH, DESA ULEE GLE, KECAMATAN BANDAR DUA, KABUPATEN PIDIE JAYA, PROVINSI ACEH, ULEE GLE, BANDAR DUA, KAB. PIDIE JAYA, ACEH"
S0WSGDIO,Penentuan KA SPPG,Belum Beroperasi,KAB. SAMPANG,JAWA TIMUR,"Jl. Syuhada gang II RT 04 RW 05 Kel Dalpenang Kec Sampang Kab Sampang, DALPENANG, SAMPANG, KAB. SAMPANG, JAWA TIMUR"
SZ5WWWYP,Penentuan KA SPPG,Belum Beroperasi,KAB. CIANJUR,JAWA BARAT,"KP,CIBOLANG RT /RW ,003/001 DESA JAMALI KECAMATAN MANDE , JAMALI, MANDE, KAB. CIANJUR, JAWA BARAT"
3PHMYTGK,Penentuan KA SPPG,Belum Beroperasi,KAB. CIANJUR,JAWA BARAT,"Jl. Cimatis Kp.Ngantay RT/RW 12/03 Desa Lembahsari Kecamatan Cikalongkulon
Kabupaten Cianjur 43291, LEMBAHSARI, CIKALONGKULON, KAB. CIANJUR, JAWA BARAT"
EOZ9N8XV,Penentuan KA SPPG,Belum Beroperasi,KOTA BEKASI,JAWA BARAT,"Jalan Ganceng no.29, Jatiranggon, Jati sampurna, Bekasi Kota 17432, JATIRANGGON, JATISAMPURNA, KOTA BEKASI, JAWA BARAT"
MRQC9CXP,Penentuan KA SPPG,Belum Beroperasi,KAB. PURWAKARTA,JAWA BARAT,"Kampung citeko Tegalkalapa RT. 12 RW. 04 Kecamatan Plered Kabupaen Purwakarta

, CITEKO, PLERED, KAB. PURWAKARTA, JAWA BARAT"
27KJOLVS,Penentuan KA SPPG,Belum Beroperasi,KAB. CIANJUR,JAWA BARAT,"Kp. Cipakis RT 04 RW 09 Desa Cidamar Cidaun Kecamatan Cidaun Kabupaten Cianjur Jawa Barat, CIDAMAR, CIDAUN, KAB. CIANJUR, JAWA BARAT"
CVZUHXOQ,Penentuan KA SPPG,Belum Beroperasi,KAB. CIANJUR,JAWA BARAT,"Kp. Cikawung, RT 01 RW 02 Desa Talagasari, Kecamatan Sindangbarang, Kabupaten Cianjur, Jawa Barat, TALAGASARI, SINDANGBARANG, KAB. CIANJUR, JAWA BARAT"
GU4PFNA8,Penentuan KA SPPG,Belum Beroperasi,KAB. LOMBOK UTARA,NUSA TENGGARA BARAT,"J487+WMH Sigar Penjalin, Kabupaten Lombok Utara, Nusa Tenggara Barat, SIGAR PENJALIN, TANJUNG, KAB. LOMBOK UTARA, NUSA TENGGARA BARAT"
YOX4UUB8,Penentuan KA SPPG,Belum Beroperasi,KAB. OGAN ILIR,SUMATERA SELATAN,"Jl.	Merdeka	Lorong.	Sambur	Indah	Belakang	SMK	IT	HARAPAN PERTIWI, TANJUNG BATU, TANJUNG BATU, KAB. OGAN ILIR, SUMATERA SELATAN"
TECXW45S,Penentuan KA SPPG,Belum Beroperasi,KAB. KUDUS,JAWA TENGAH,"Jl. Bhakti No.109 Rendeng Kec. Kota Kab. Kudus, RENDENG, KOTA KUDUS, KAB. KUDUS, JAWA TENGAH"
FEZDS8FV,Penentuan KA SPPG,Belum Beroperasi,KAB. BANDUNG BARAT,JAWA BARAT,"JL. SETRADUTA HEGARMANAH NO.24, SARIWANGI, PARONGPONG, KAB. BANDUNG BARAT, JAWA BARAT"
8FTYFUSS,Penentuan KA SPPG,Belum Beroperasi,KAB. JOMBANG,JAWA TIMUR,"Jl. Tambak Rejo, Tinggar, Kec. Bandarkedungmulyo, Kabupaten Jombang, Jawa Timur 61462, TINGGAR, BANDARKEDUNGMULYO, KAB. JOMBANG, JAWA TIMUR"
E0PNFM0N,Penentuan KA SPPG,Belum Beroperasi,KOTA SEMARANG,JAWA TENGAH,"Jl. Perintis Kemerdekaan KM 14, Kel. Pudak Payung, Kec. Banyumanik, Kota Semarang, Jawa Tengah, Kode Pos 50265, PUDAKPAYUNG, BANYUMANIK, KOTA SEMARANG, JAWA TENGAH"
PUAU10TR,Penentuan KA SPPG,Belum Beroperasi,KOTA SEMARANG,JAWA TENGAH,"Jl. Setia Budi No.86, Srondol Kulon, Kec. Banyumanik, Kota Semarang, Jawa Tengah 50263, SRONDOL KULON, BANYUMANIK, KOTA SEMARANG, JAWA TENGAH"
SAJG6WOZ,Penentuan KA SPPG,Belum Beroperasi,KAB. GARUT,JAWA BARAT,"kp. Ciharashas rt.03 rw.03, cikrang ( cikarag ) malangbong garut, CIKARANG, MALANGBONG, KAB. GARUT, JAWA BARAT"
RW70CRPG,Penentuan KA SPPG,Belum Beroperasi,KAB. BANDUNG BARAT,JAWA BARAT,"Kp Pangapuran RT03 RW02 Desa Cipatat Kecamatan Cipatat Kabupaten Bandung Barat, CIPATAT, CIPATAT, KAB. BANDUNG BARAT, JAWA BARAT"
DAFPPEWF,Penentuan KA SPPG,Belum Beroperasi,KAB. CIANJUR,JAWA BARAT,"Kp Cilaku RT 05 RW 02 Desa Sukasari Kec. Cilaku Kab. Cianjur Jawa Barat, SUKASARI, CILAKU, KAB. CIANJUR, JAWA BARAT"
NVZ98ONW,Penentuan KA SPPG,Belum Beroperasi,KAB. CIAMIS,JAWA BARAT,"Jl. Banjarsari - Lakbok N0 216
Sindanghayu, Banjarsari - Ciamis, SINDANGHAYU, BANJARSARI, KAB. CIAMIS, JAWA BARAT"
Y52AHQG2,Penentuan KA SPPG,Belum Beroperasi,KAB. KUBU RAYA,KALIMANTAN BARAT,"Komplek Griya satria persada 1, No B9, Desa Kapur Kec Sungai Raya Kab Kubu Raya, KAPUR, SUNGAI RAYA, KAB. KUBU RAYA, KALIMANTAN BARAT"
MMJWF895,Penentuan KA SPPG,Belum Beroperasi,KAB. SERANG,BANTEN,"Jl. Rego No.10, Mekarbaru, Kec. Petir, Kabupaten Serang, Banten 42172, MEKAR BARU, PETIR, KAB. SERANG, BANTEN"
F7TVGMGW,Penentuan KA SPPG,Belum Beroperasi,KAB. MUARA ENIM,SUMATERA SELATAN,"Dusun III Desa Tambangan Kelekar. Kec, Gelumbang. Kab, Muara Enim. Prov, Sumatera Selatan Kode Pos 31171, TAMBANGAN KELEKAR, GELUMBANG, KAB. MUARA ENIM, SUMATERA SELATAN"
1ATXKS4Q,Penentuan KA SPPG,Belum Beroperasi,KAB. GROBOGAN,JAWA TENGAH,"Jl. MH. Thamrin gg iv sambak, Desa Danyang, Kec.Purwodadi, Kab.Grobogan, Provinsi Jawa Tengah, DANYANG, PURWODADI, KAB. GROBOGAN, JAWA TENGAH"
LLJQL07U,Penentuan KA SPPG,Belum Beroperasi,KAB. TASIKMALAYA,JAWA BARAT,"Jl. Raya Jamanis, Tanjungmekar KM.17, TANJUNGMEKAR, JAMANIS, KAB. TASIKMALAYA, JAWA BARAT"
NTPWDNDY,Penentuan KA SPPG,Belum Beroperasi,KAB. OGAN ILIR,SUMATERA SELATAN,"Desa meranjat 1 dusun 8 kecamatan inderalaya selatan kabupaten ogan ilir, MERANJAT I, INDRALAYA SELATAN, KAB. OGAN ILIR, SUMATERA SELATAN"
FHJROWNI,Penentuan KA SPPG,Belum Beroperasi,KOTA TANGERANG SELATAN,BANTEN,"JL. WIJAYA KUSUMA UJUNG IV NO 144. RT 11/01., PONDOK BETUNG, PONDOK AREN, KOTA TANGERANG SELATAN, BANTEN"
J7NK98FV,Penentuan KA SPPG,Belum Beroperasi,KAB. GROBOGAN,JAWA TENGAH,"Dusun Ploso RT004/RW001 Desa Plosorejo, Kec.Tawangharjo, Kab.Grobogan, Provinsi Jawa Tengah, PLOSOREJO, TAWANGHARJO, KAB. GROBOGAN, JAWA TENGAH"
QYYRUHLF,Penentuan KA SPPG,Belum Beroperasi,KAB. GARUT,JAWA BARAT,"kp.sukajaya RT.003/RW.004, SUKAJAYA, MALANGBONG, KAB. GARUT, JAWA BARAT"
VTT8YMG5,Penentuan KA SPPG,Belum Beroperasi,KAB. LAMONGAN,JAWA TIMUR,"Jl. Raya mantup desa pelang kec. kembangbahu  kab. Lamongan Jawa Timur, PELANG, KEMBANGBAHU, KAB. LAMONGAN, JAWA TIMUR"
EWNRH3YW,Penentuan KA SPPG,Belum Beroperasi,KAB. GROBOGAN,JAWA TENGAH,"Jl. Provinsi Purwodadi-Blora, RT 01/RW 03 Desa Rejosari, Kec.Grobogan, Kab.Grobogan, Provinsi Jawa Tengah, REJOSARI, GROBOGAN, KAB. GROBOGAN, JAWA TENGAH"
KA0HECUV,Penentuan KA SPPG,Belum Beroperasi,KAB. SERANG,BANTEN,"jl. kh. marta, singamarta, SINGAMERTA, CIRUAS, KAB. SERANG, BANTEN"
Y89VVUEH,Penentuan KA SPPG,Belum Beroperasi,KAB. KARANGANYAR,JAWA TENGAH,"Jl. Sadewa, Manggeh Anyar, Lalung, Kec. Karanganyar, Kabupaten Karanganyar, Jawa Tengah. 57716, LALUNG, KARANGANYAR, KAB. KARANGANYAR, JAWA TENGAH"
3TKUOYOJ,Penentuan KA SPPG,Belum Beroperasi,KAB. BOGOR,JAWA BARAT,"Kp. Kabasiran RT 02/RW 02, Kabasiran, Parungpanjang, Bogor, KABASIRAN, PARUNG PANJANG, KAB. BOGOR, JAWA BARAT"
TZAJXD6P,Penentuan KA SPPG,Belum Beroperasi,KAB. INDRAMAYU,JAWA BARAT,"Desa Gabus Kulon Blok Condong Gabus Udik Rt 01 Rw 02, GABUS KULON, GABUSWETAN, KAB. INDRAMAYU, JAWA BARAT"
02BEBBBF,Penentuan KA SPPG,Belum Beroperasi,KAB. JEMBER,JAWA TIMUR,"Jl. Tawes 304 RT 02 RW 04 Kelurahan Kaliwates Kecamatan Kaliwates Kabupaten  Jember Jawa Timur, KALIWATES, KALIWATES, KAB. JEMBER, JAWA TIMUR"
SVCK11SG,Penentuan KA SPPG,Belum Beroperasi,KAB. TANGERANG,BANTEN,"Jalan Bojong No 99
Desa Kemuning Legok 
Tangerang, KEMUNING, LEGOK, KAB. TANGERANG, BANTEN"
